175	Patricia Waszyk	University of Lausanne	Institut Universitaire de Pathologie CHUV	2015-11-01	2018-10-31	Epigenetic mechanisms regulating Ewing's sarcoma cancer stem cell properties	There is increasing evidence that epigenetics play a major role in tumors by regulating gene expression and thus increasing cell capacity of self-renewal and proliferation, without altering the primary DNA sequence. Three types of epigenetic alterations are currently believed to be causally implicated in providing cancer cells with the ability to drive tumor growth and progression, namely DNA methylation, chromatin remodelling as a result of covalent histone modifications and non-coding RNAs, particularly microRNAs (miRNA). Precise understanding of such mechanisms may help identify a set of targets for the development of new therapeutic strategies.The cancer stem cell (CSC) model was revived in recent years with the notion that a tumor initiating cell acquires increased self-renewal capacity through genetic mutations and epigenetic modification, maintaining the tumor drive indefinitely. CSC express various embryonic stem cell genes, including CD133, often used a stem cell marker. CSC are capable to reproduce the original tumor in vivo upon injection in immunocompromised mice, thereby giving birth to heterogenous cell subpopulations, composed of CSC as well as more differentiated progeny. As they are more prone to chemotherapy resistance, it can be conceived that targeting and eradicating CSC may lead to cure of cancers in which CSC provide the driving force for growth and progression.In the case of Ewing’s sarcoma family of tumors (ESFT), a group of rare but highly aggressive tumors arising in mesenchymal tissue in children and young adults, conventional chemotherapies are not sufficient to effectively treat patients and prevent relapse, primarily due to early metastasis. 85% of ESFT present a single mutation, the translocation t(11;22), leading to the formation of an aberrant fusion protein EWS-FLI1.The epigenetic state of primary cells is believed to determine whether they may or may not be permissive for oncogene-induced transformation. Thus, in depth understanding of epigenetically regulated cell permissiveness for oncogene expression and the mechanisms that regulate epigenetic changes upon transformation are key steps toward developing rational mechanism-based targeted anti-cancer therapies.The aim of my project will be to further investigate the role of epigenetics in regard to EWS-FLI1 by identifying and characterizing CSC and exploring how epigenetic alterations lead to their emergence and direct their tumor initiating and metastasis promoting properties.1- Determination and analysis of ESFT cells signature epigenetic profile.First, I will describe the epigenetic profile of spherogenic and adherent ESFT cells. I will address the epigenetic markers changes between the more tumorigenic sphere-forming cells and the adherent cells by focusing on histone methylation and acetylation.2- Determination of chromatin modification in CD133+ versus CD133- cells.Secondly, I will determine chromatin modifications in CD133+ versus CD133- cells. These cells will be isolated from fresh human tumor samples or from ESFT propagated in immunocompromised mice. I will also assess the influence of human versus murine microenvironment on CD133+ epigenetic markers.3- Assessment of epigenetic changes that underlie cell permissiveness for EWS-FLI1 expression and function.Finally, as EZH2 has been shown to facilitate EWS-FLI1 expression in fibroblasts, I will perform RNA-seq gene expression comparison between cells transduced with EZH2 and their control counterparts. I will then perform ChIP-seq on both sets of fibroblasts to identify EZH2-induced chromatin mark changes and correlate them with gene expression data. Selected genes could be tested for responsibility in blocking or enhancing permissiveness for EWS-FLI1 expression.The major contribution of this work will be to assess epigenetic differences between fresh primary tumor initiating and non-tumorigenic bulk tumor cells in ESFT. Such a study has never been done in part because of the paucity of primary tumor samples and in part because of the challenge of nano-ChIP-seq technology. My host lab provides me with the possibility to overcome both obstacles as it possesses and continues to obtain primary ESFT samples and has established nano-ChIP-seq technology. In addition, the project will assess the effect of in vitro culture and mouse propagation on CSC and non-CSC ESFT populations, which is a central issue toward understanding how well cultured tumor cells and tumor cells grown in mice represent the corresponding fresh primary cells. Finally, the project will define the epigenetic events that convert a non-permissive to a permissive cellular environment for EWS-FLI-1 expression and function, which will provide important and long sought insight into the pathogenesis of ESFT.	Swiss National Science Foundation	MD-PhD fellowships (funded by SNSF)	180000.0	CHF
176	Professor Jonathan Strefford	University of Southampton	Southampton General Hospital	2014-08-01	2017-08-01	Integrating genetics and epigenetics to unravel their clinical importance in CLL	None	Blood Cancer UK	Project Grant	None	None
177	Professor A Maxwell	Queen's University of Belfast	None	2016-04-01	2019-12-31	Integrative genomic, epigenetic and functional studies in diabetic kidney disease	Diabetic kidney disease (DKD) is a leading cause of kidney failure and end stage renal disease, and brings a substantial burden of early mortality and accompanying health care costs. Genetic factors contribute to the risk of DKD. If we could identify these genetic factors, we could better understand the mechanisms by which DKD occurs, and thereby accelerate the development of better therapies. We established the GENIE consortium, a collaboration between Queen's University Belfast, University of Dublin, University of Helsinki, and the Broad Institute. Together, we completed the largest genetic study to date of DKD, and successfully identified the first two robust genetic risk factors for DKD. In a separately funded genetic study, we are collaborating with additional groups to extend our efforts and encompass larger samples. To better understand the underlying biology and pathophysiology of DKD, we propose to complement and build on our past and ongoing genetic studies in several critical ways. We will leverage a co-funding mechanism between Ireland, Northern Ireland and the US to carry out a multidisciplinary investigation of DKD. We will assemble and jointly analyze all available genetic data pertinent to DKD, to begin the process of discovering rarer variants with stronger effects on DKD. We will also generate DNA methylation data in kidney and blood, and in patients with and without DKD, and also expression data in samples relevant to DKD. We use a novel and powerful method to integrate the genetic, epigenetic and genomic data to generate hypotheses about the biological causes of DKD, and test these hypotheses with further genetic studies (sequencing in a large follow-up sample) and with functional studies in models of DKD. This international, multidisciplinary collaboration will build on genetic discoveries to help decipher the underlying biology and pathophysiology of DKD and thereby guide the prevention and treatment of this important disease.	Medical Research Council	P&Cs	150000.0	GBP
178	Dr Constance Alabert	University of Dundee	None	2017-01-01	2022-12-31	CHROMATIN REPLICATION AND CANCER	Since decades, cancer etiology is considered as a key step to find innovative treatments. Indeed progress in understanding tumorigenesis mechanisms has proved its therapeutics potential, yet most of them remained elusive or unknown. The research plan presented here is in line with this ongoing effort, proposing to explore promising new mechanisms in tumorigenesis using cutting edge technologies. Cancer cells are characterized by the presence of genetic and epigenetic alterations that lead to loss of cell identity, uncontrolled cell proliferation, cell invasion and metastasis. However, upstream events that drive the appearance and selection of these alterations remain poorly understood. Past two decades has revealed the key function of epigenetics mechanisms in maintaining cell identity and genome stability whereas their corruption is a hallmark of tumorigenesis and cancer progression. Epigenetic information relies on a combination of DNA modifications, nucleosomes positioning and modification, and many proteins that define, maintain and functionally translate this information. Therefore to maintain cell identity, faithfully duplication and transmission of epigenetic information to daughter cells is as important as duplication and transmission of the genetic information. However, little is known about how the epigenetic information is propagated during the cell cycle and recent findings raise the question of its potential implication in tumorigenesis. In S phase, the progression of DNA replication forks provokes a genome-wide disruption of the epigenetic information. This proposal aims to reveal how cells restore epigenetic information after DNA replication and to explore the interplay between these mechanisms and tumorigenesis. To this end, I will combine Nascent Chromatin Capture (NCC), a technology for purification of newly synthetized chromatin that I have developed, with mass spectrometry, high-throughput microscopy and screening technologies in normal and cancer cells. Newly identified players that are subjected to deregulation in cancer will be next characterized in order to understand their role in cancer development and their therapeutic potential.	Cancer Research UK	NIC - Career Development Fellowship	None	None
179	Dr Scheiermann	Ludwig-Maximilians-Universität München	None	2015-09-01	2020-09-01	Cell-type specific mechanisms regulating rhythms in leukocyte homing	Leukocytes are the key components of the immune system that fight infections and provide tissue repair, yet their migration patterns throughout the body over the course of a day are completely unknown. Circadian, ~24 hour rhythms are emerging as important novel regulators of immune cell migration and function, which impacts inflammatory diseases such as myocardial infarction and sepsis. Altering leukocyte tissue infiltration and activation at the proper times provides an option for therapy that would maximize the clinical impact of drugs and vaccinations and minimize side effects. We aim to create a four-dimensional map of leukocyte migration to organs in time and space and investigate with epigenetics techniques the molecular mechanisms that regulate cell-type specific rhythms. We will functionally define the daily oscillating molecular signature(s) of leukocytes and endothelial cells with novel proteomics approaches and thus identify a circadian traffic code that dictates the rhythmic migration of leukocyte subsets to specific organs under steady-state and inflammatory conditions with pharmacological and genetic tools. We will assess the impact of lineage-specific arrhythmicities on immune homeostasis and leukocyte trafficking using an innovative combination of novel genetic tools. Based on these data we will create a model predicting circadian leukocyte migration to tissues. The project combines the disciplines of immunology and chronobiology by obtaining unprecedented information in time and space of circadian leukocyte trafficking and investigating how immune-cell specific oscillations are generated at the molecular level, which is of broad impact for both fields. Our extensive experience in the rhythmic control of the immune system makes us well poised to characterize the molecular components that orchestrate circadian leukocyte distribution across the body.	European Research Council	Starting Grant	1497688.0	EUR
180	Prof. Tim Nawrot	UNIVERSITEIT HASSELT	None	2013-03-01	2018-03-01	Unravelling environmental exposures in the core axis of ageing	AGEing is a complex phenotype responsive to a plethora of ENVIRONmental inputs (ENVIRONAGE). Age related conditions in adults often find their origin in risk factors operative in early life. The molecular mechanisms behind these phenomena remain largely unknown. Mitochondria are involved in a variety of critical cell functions, including oxidative energy production and programmed cell death. Recently, I established in a study of 175 newborns, a strong association between mitochondrial DNA content and in utero exposure to particulate air pollution. Telomere length is highly heritable and erosion leads to an increasingly vulnerable structural integrity of the chromosomes. It is considered a marker of overall biological age compared with chronological age. In this regard, I demonstrated the heritability of telomere length and the influence of smoking on telomere erosion. These results support the ENVIRONAGE hypothesis, i.e. that environmental inputs influence biomolecular markers of ageing including mitochondrial function, telomere length along with DNA repair and epigenetics as the ‘core axis of ageing’. The aim is to establish prospective epidemiological evidence for molecular mechanisms or early biomarkers, which may underlie the origins or reflect the risk of age-related diseases and to understand its association with other processes and the influence of environmental factors. To this end, I will establish a birth cohort and a cohort in middle-aged and elderly. I measure environmental pollutants, in interaction with parameters that I consider to have an important role in the ageing process (mitochondrial function, telomere length, epigenetics and DNA repair capacity). ENVIRONAGE integrates environmental influences and molecular mechanisms on ageing. The common molecular epidemiological strategies in newborns, middle-aged and elderly to unravel the environmental influence on ageing are groundbreaking.	European Research Council	Starting Grant	1473910.0	EUR
181	Dr Laura EME	CENTRE NATIONAL DE LA RECHERCHE SCIENTIFIQUE CNRS	None	2019-03-01	2024-02-29	The macroevolutionary impact of epigenetics and lateral gene transfer on eukaryotic genomes	Multicellular organisms (e.g., animals, fungi and plants) are the best-studied eukaryotes but their ancestors and the vast majority of eukaryotic diversity correspond to microbial species (“protists”). The evolutionary history of protists is closely connected to the evolution of the eukaryotic cell itself. However, most protist diversity is still genomically unexplored, limiting our investigation of eukaryotic evolution. For example, while the importance of lateral gene transfer (LGT) in prokaryotic evolution is well recognized, its role in eukaryotic evolution is still debated. In addition, although epigenetic mechanisms represent a hallmark of eukaryotic genome regulation, we know surprisingly little about the evolution of these mechanisms across eukaryotic diversity. The overarching goal of my project is to understand how epigenetic mechanisms and LGT have shaped the macroevolution of eukaryotic genomes. This project has several inter-related intermediate objectives, which each in themselves will bring crucial insights into eukaryotic evolution: 1) reconstructing a robust phylogeny of eukaryotes; 2) inferring the gene content of the Last Eukaryotic Common Ancestor; 3) tracing the evolution of genes involved in epigenetic mechanisms and obtaining epigenomic maps from under-studied protists; 4) investigating the intriguing hypothesis of a possible interplay between epigenetic regulation and horizontal gene transfer and its influence on eukaryotic genome evolution: Have genes involved in epigenomic mechanisms been transferred between eukaryotes? Do epigenomic modifications affect the frequency of LGT in different lineages? To achieve this, I will characterize the transcriptomes, genomes, methylomes and small RNAs of understudied eukaryotic microbes selected for their key phylogenetic position, and to analyse them using state-of-the-art bioinformatic methods. I will target uncultivated protists, using single-cell techniques and novel genome-scaffolding approaches.	European Research Council	Starting Grant	1499945.0	EUR
182	Dr Leonidas Chouliaras	University of Cambridge	None	2018-08-01	2020-07-31	A pilot study on neuron specific methylomic analysis in Dementia with Lewy Bodies	Dementia with Lewy Bodies (DLB) is the second most common neurodegenerative dementia in older people. Although epigenetic changes, and in particular of DNA methylation (DNAm), have been linked with Alzheimer's and Parkinson's disease, with findings opening novel diagnostic and therapeutic targets, they have not been studied in DLB. This pilot study aims to explore the role of neuronal DNAm changes in DLB by combining laser-capture microdissection (LCM), for isolation of specific neurons affected by pathology, with genome-wide DNAm analysis using reduced representation bisulphite sequencing (RRBS). Our hypothesis is that DLB pathogenesis is associated with distinct epigenetic changes that can help to identify therapeutic targets. We also hypothesise that neurons bearing Lewy body pathology have a specific epigenetic signature compared to unaffected ones. To address our hypotheses this pilot project aims to: 1. Optimize and test the methodology for LCM of specific neurons from post-mortem brain suitable for DNAm analysis. 2. Combine LCM with RRBS for neuronal methylomic profiling of DLB cases and matched controls 3. Compare methylomic profiles of affected by Lewy Body pathology neurons with unaffected neurons within each individual 4. Identify methylation quantitative trait loci in DLB by combining methylomic profiling with available genomic data 5. Associate methylation changes with ante-mortem cognitive and neuroimaging data The analyses will focus both on known risk genes that have been previously linked with DLB (e.g SNCA) and on genome-wide analyses for identification of novel targets. Data gathered from this project will be the basis for future larger scale work.	The Academy of Medical Sciences	None	29668.0	GBP
183	Dr. Gian Gaetano Tartaglia	FUNDACIO PRIVADA CENTRE DE REGULACIO GENOMICA	None	2013-01-01	2018-01-01	The Role of Non-coding RNA in Protein Networks and Neurodegenerative Diseases	A major portion of the eukaryotic genome is occupied by DNA sequences whose transcripts do not code for proteins. This part of the genome is transcribed in a developmentally regulated manner and in response to external stimuli to produce large numbers of long non-coding RNAs (lncRNAs). From the beginning of transcription through splicing and translation, RNA molecules are associated with numerous RNA binding proteins that regulate their processing, stability, transport and translation. Both coding and non-coding RNAs and their associated binding proteins are involved in numerous cellular pathways. These pathways, which include RNA processing and the regulation of transcription and translation, are critical determinants of neuronal differentiation and plasticity. Alterations in these pathways have been identified to contribute to a wide variety of neurodegenerative diseases. Mutations in two RNA binding proteins involved in RNA splicing, the Tar DNA binding protein of 43kd (TDP-43) and Fused in Sarcoma (FUS), cause amyloid aggregation and are associated with Amyotrophic Lateral Sclerosis (ALS). My main interest is to understand the role played by RNA molecules in protein networks. Characterizing protein-RNA associations is key to unravel the complexity and functionality of mammalian genomes. In this project, I propose to study associations of lncRNAs with proteins involved in i) transcriptional regulation and epigenetics (such as polymerases, transcription factors and chromatin-modifiers) and ii) neurodegenerative diseases (such as Parkinson’s -synuclein, Alzheimer’s disease amyloid protein APP, TDP-43 and FUS). In particular, I will investigate if RNA molecules are involved in regulatory mechanisms that control protein production and prevent formation of toxic aggregates. In a multidisciplinary effort, I aim to discover protein-RNA interactions using advanced computational methods developed in my group and state of the art experimental techniques.	European Research Council	Starting Grant	1465351.0	EUR
184	Dr. Luca GIORGETTI	Friedrich Miescher Institute for Biomedical Research	None	2018-01-01	2022-12-31	Biophysical mechanisms of long-range transcriptional regulation	In mammals, transcriptional control of many genes relies on cis-regulatory elements such as enhancers, which are often located tens to hundreds of kilobases away from their cognate promoters. Functional interactions between distal regulatory elements and target promoters require mutual physical proximity, which is linked to the three-dimensional structure of the chromatin fiber. Chromosome conformation capture studies revealed that chromosomes are partitioned into Topologically Associating Domains (TADs), sub-megabase domains of preferential physical interactions of the chromatin fiber. Genetic evidence showed that TAD boundaries restrict the genomic range of enhancer-promoter communication, and that interactions between regulatory sequences within TADs are further fine-tuned by smaller-scale structures. However, the mechanistic details of how physical interactions translate into transcriptional outputs are totally unknown. Here we propose to explore the biophysical mechanisms that link chromosome conformation and long-range transcriptional regulation using molecular biology, genetic engineering, single-cell experiments and physical modeling. We will measure chromosomal interactions in single cells and in time using a novel method that relies on an enzymatic process in vivo. Genetic engineering will be used to establish a cell system that allows quantitative measurement of how enhancer-promoter interactions relate to transcription at the population and single-cell levels, and to test the effects of perturbations without confounding effects. Finally, we will develop physical models of promoter operation in the presence of distal enhancers, which will be used to interpret the experimental data and formulate new testable predictions. With this integrated approach we aim at providing an entirely new layer of description of the general principles underlying transcriptional control, which could establish new paradigms for research in epigenetics and gene regulation.	European Research Council	Starting Grant	1500000.0	EUR
185	Dr. Alberto Palloni	AGENCIA ESTATAL CONSEJO SUPERIOR DEINVESTIGACIONES CIENTIFICAS	None	2019-03-01	2024-02-29	Early conditions, delayed adult effects and morbidity, disability and mortality in modern human populations	This project aims to reformulate and generalize standard theories of human health and mortality. It proposes new formal models and a systematic agenda to empirically test hypotheses that link developmental biology, epigenetics and adult human illness, disability and mortality. We seek to break new ground developing innovative formal models for illnesses and mortality, testing new hypotheses about the evolution of human health and, to the extent permitted by findings, reformulating standard theories to make them applicable to a less restrictive segment of populations than they are now. Over the past two decades there has been massive growth of research on the nature of delayed adult effects of conditions experienced in early life. This field of research is known as the Developmental Origins of Adult Health and Disease (DOHaD). Increasing evidence suggests that the mechanisms that are implicated are epigenetic and constitute an evolved adaptation selected over thousands of years to improve fitness in changing landscapes. The emergence of DOHaD is as close as we will ever come to a paradigmatic shift in the study of human health, disability and mortality. The most tantalizing possibility is that advances in our understanding of epigenetic mechanisms will shed light on pathways linking early exposures and delayed adult health thus fundamentally transforming our understanding of human illnesses and, in one fell swoop, bridge population health, epigenetics, and developmental and evolutionary biology. The overarching goal of this project is to contribute to this nascent area of study by (a) proposing new formal demographic models of health, disability and mortality; (b) empirically testing DOHaD predictions with population data; (c) testing a microsimulation model to verify DOHaD predictions about two conditions, obesity and Type 2 Diabetes, and (d) assessing the adult health, disability and mortality toll implicated by relations between early conditions, obesity and T2D.	European Research Council	Advanced Grant	2852655.0	EUR
