61	Professor Moin Saleem	University of Bristol	Clinical Science at North Bristol	2017-04-01	2020-12-31	Trans-national cohorts of nephrotic syndrome - a unified approach to a global chronic disease	Kidney disease in LMICs is under recognised and severely under resourced. The incidence of one of the commonest types of renal disease (in adults and children), idiopathic nephrotic syndrome (INS), appears considerably higher in LMICs than in the developed world. This is likely contributed to by a combination of infectious triggers and genetic background, though other factors remain unknown. The biological understanding of glomerular disease has been revolutionised recently by study of the glomerular podocyte, the target cell in INS, alongside significant genetic advances. The field is ripe for translational research on wider patient cohorts to exploit compelling biological hypotheses arising from this work. This proposal brings together researchers with complementary strengths, and will enable knowledge transfer between all partners. The host laboratory in the UK is a world leader in podocyte biology and INS population genetics, and has well-established links with key leaders in nephrology in several LMICs. In the UK we established a national renal patient registry (www.rarerenal.org) and biorepository, with widespread clinician and patient buy-in that is recognised as innovative. We propose to extend this concept internationally, to build a vibrant and cohesive network of academic centre leads in three LMICs with the UK centre as a hub. The downstream benefits will be (i) establish a team of LMIC centres consistently trained in laboratory research/diagnostic techniques and clinical database/biobank establishment (ii) a pipeline to transfer cutting edge translational biology advances from the UK laboratory (and elsewhere) to establish novel biomarker assays locally (iii) share clinical trials methodology that will maximise impact of biomarker findings in large cohorts of patients. Links to Bristol will facilitate definitive studies on genomics, transcriptomics, and epigenetics in this carefully phenotyped population, with on going sustainable skills development	Medical Research Council	Research Grant	532742.0	GBP
62	Dr Marcus Munafo	University of Bristol	None	2013-06-01	2018-03-31	Determinants, Consequences and Modification of Health Behaviours	Modifiable lifestyle health behaviours, such as tobacco use, alcohol consumption, exercise and dietary behaviour reflect the primary modifiable causes of morbidity and mortality in developed countries such as the United Kingdom. Despite concerted public health campaigns, in some cases over several decades, the prevalence of unhealthy lifestyle behaviours remains high, and in many cases is strongly socially patterned, contributing substantially to health inequalities. Understanding the developmental trajectories of, and pathways into, these behaviours is therefore necessary if we are to develop new interventions, in order to improve individual and public health, and reduce associated personal and societal harms. In addition, although some of the negative health and mental health consequences of these behaviours are known, many are not, or remain controversial. A more complete understanding of the consequences of these behaviours will also inform public health campaigns and other interventions. This programme will focus initially on tobacco and alcohol use, as two of the largest contributors to morbidity and premature mortality in developed countries, and extend this work into other health behaviours (e.g., caffeine use, overeating and obesity, exercise). The work will proceed along three parallel workstreams, to address three primary aims: 1) to understand the developmental trajectories and determinants of health behaviours; 2) to conduct causal analyses of the causes and consequences of health behaviours; and 3) to develop interventions to modify health behaviours in adolescence and adulthood. This work will be integrated across the other programmes within the MRC University of Bristol Integrative Epidemiology (IEU) Unit, making use of methodological developments in Mendelian randomization (including the use of allelic risk scores), epigenetics, and recall-by-genotype methods, as well as conventional epidemiological and experimental methods. Ultimately, we aim to provide a much more detailed understanding of the factors that lead to unhealthy lifestyle behaviours, and clarify the impact of these behavioural on physical and mental health where this remains uncertain. This, in turn, will enable us to develop interventions to modify health behaviours at an individual and population level.	Medical Research Council	Unit	None	None
63	Mr Andrew Schache	University of Liverpool	None	2010-09-01	2012-08-31	The epigenetics of HPV16-mediated oral and oropharyngeal squamous cell carcinoma.	None	Wellcome Trust	Research Training Fellowship	179707.0	GBP
64	Dr Alexander Drong	University of Oxford	Wellcome Trust Centre for Human Genetics	2016-04-01	2019-03-31	Early life DNA methylation patterns linking intra-uterine events to adverse cardiometabolic outcomes	In the early stages of the fellowship, I will perform the largest to-date EWAS case/control study for GDM (N=600/600 in subjects originating from Tianjin, China. Subsequently, I will replicate/validate my findings in an independent set of GDM samples (N=200/800). Association testing will be carried out by fitting probe-wise linear models, with adjustments for biological and technical confounders (control probe principal components). The relevance of DNA methylation hits can be tested by robust pathway enrichment tests of genes associated with the differentially methylated CpG sites with functional ontologies using custom developed scripts that adjust for probe coverage bias (goseq). Overlaying relevant Roadmap Epigenome data by performing permutation tests utilizing random sampling of matched CpG sites. I expect this work to identify specific DNA methylation sites, with a detectable and predominant association with GDM. In the later stages of the fellowship, I will lead the experimental design for the methylation experiments by performing large-scale epigenome-wide association scans. This will include detecting associations of IUGR/SGA with methylation by using cases and controls recruited at delivery (N=600/600) and finding methylation marker associated with foetal growth in a longitudinal study (N~2,500) with multiple anthropometric measurements throughout pregnancy. The multi-ethnic design of this study will also allow me to establish transethnic effects. Lastly, I will be utilizing genetic variants as instrumental variables in two-step Mendelian Randomization to determine whether epigenetic markers are in causal pathways downstream to intra-uterine events.	Medical Research Council	Fellowship	268855.0	GBP
65	Professor George Ebers	University of Oxford	None	2008-02-01	2010-07-31	Molecular epigenetics of multiple sclerosis	None	Multiple Sclerosis Society	Project	250848.0	GBP
66	Dr. Manu DUBIN	GMI - Gregor Mendel Institute of Molecular Plant Biology	None	2011-12-01	2013-11-30	An epigenome-wide association studys in plants	The creation, or selection, of plant cultivars with more sophisticated traits and improved adaptability to extreme environmental perturbations will require detailed knowledge of the many factors controlling the plant phenotype. Heritable variation was traditionally thought to occur exclusively as a result of DNA sequence polymorphisms, but it is now clear that a significant portion of heritable variation occurs by other means, among which epigenetic processes appear to play a major role (Madlung and Comai, 2004; Richards, 2006; Richards, 2008; Bossdorf et al., 2008). Understanding the degree of epigenetic diversity and its influence on the relationship between environment, genotype and phenotype should improve our ability to predict the effect of environmental changes on performance and potential of plants and their progeny. To reach this goal this project aims to: • quantify the amount of epigenetic variation that occurs as a result of DNA sequence polymorphisms, and identify which epigenetic marks are involved, • quantify the amount of epigenetic variation that occurs as a result of environmental variation, and detect which environmental changes and which marks are involved, • investigate the interplay of genetic, epigenetic and environmental variation on phenotype. To date, a major stumbling block in the field has been the sheer complexity of, and the interplay between, the many factors that control the phenotype. We propose to overcome this by integrating methodologies from the fields of both population genetics and classical epigenetics. Specifically, we will extend genome-wide association studies by using whole genome approaches such as sequencing after chromatin immunoprecipitation (ChIP-seq) and after bisulfite conversion (BS-seq) to map the epigenome, and RNA-sequencing (RNA-seq) to investigate the transcriptome. In this approach, a set of Arabidopsis accessions, selected to be both genetically and potentially epigenetically most divergent, will be subject to epigenomic profiling for DNA methylation, histone modifications and nucleosome occupancy. The differences in distribution of chromatin marks between the accessions will then be used as “epi-phenotypes” for genome-wide association mapping. They will also be used as “epi-polymorphisms” for epigenome-wide association studies (EWAS). These experiments will be repeated on plants that have been grown for multiple generations under a variety of conditions favoring slow or fast growth, in extreme habitats or under different climatic conditions, nutrition or light regimes. This will enable us to understand the relationship between genetic, environmental and chromatin variation, to address which biotic and abiotic factors induce epigenetic variation, and to explore the link between genetic and epigenetic variation, phenotypic plasticity and environmental adaption. The inheritance of chromatin marks over multiple generations and their effect on phenotype will be used to examine the role of epigenetics in transgenerational memory and environmental adaption.	Austrian Science Fund FWF	Lise Meitner Programme	117560.0	EUR
67	Univ.Prof. Dr. Mathias MÜLLER	University of Veterinary Medicine, Vienna	None	2017-03-01	2021-02-28	Monarchies and Hierarchies in Shaping Chromatin Landscapes	Advances in next generation sequencing (NGS) and in protein biochemistry are transforming our understanding of the mechanisms that control transcription in eukaryotic cells. Transcriptional profiles are directed by the chromatin landscape and 3D structure (‘architecture’), which is affected by the presence of specific combinations and concentrations of transcription factors. The SFB consortium proposes to examine general principles that underlie switches in transcription profiles, such as those that occur in normal and aberrant development, in the reaction to infection and in carcinogenesis. Using JAKSTAT signalling as a paradigm, we propose to test the following key hypotheses. Transcription factors represent indispensable elements in regulating chromatin shape, i.e. they are either pioneer factors in chromatin remodelling and modification, or readers of epigenetic information deposited by other transcription factors. In particular, we hypothesize that homeostatic and dynamic (‘acute stressed’) and constrained (‘chronically stressed’, mutated/cancerous) cellular programmes critically depend on the status of JAKSTAT signalling. Key transcription factors act in concert with different repertoires of associated factors to exert functions that are strictly context-dependent. For STATs and JAKs, we hypothesize that STATs have JAK-dependent and -independent functions and vice versa. We propose that the availability of STATs, their isoforms and their interaction partners determine their role as inducers of chromatin modification or as classical transcription factors. The work will be pursued in haematopoietic cells in the context of STAT1/3/5 and TYK2 activities in immune responses (‘acute/chronic’ stressed landscapes) or malignant transformation (‘constrained’, mutated landscapes). The central aim is to determine at which hierarchical levels JAK-STAT influences cell and organismic homeostasis as well as disease. The expertise of the consortium members ranges from immunity, haematopoietic malignancies and epigenetics to bioinformatics. The SFB has the critical mass to develop and exploit next-generation methodologies, including assays for genome-wide 3D chromatin interactions, chromatin accessibility, DNA methylation states and ChIP-Seq (if necessary combined with mass spectrometry) and deep NGS for various classes of RNA. ‘Disease-tailored’ mouse models and genome editing will be used to translate the findings to disease. Animal experimentation will be approved by an Ethics committee and the national authorities and will strictly follow the 3R principles. The SFB would be hosted by the University of Veterinary Medicine Vienna with the participating institutions CeMM Austrian Academy of Sciences, MFPL University of Vienna, Medical University of Vienna and Ludwig Boltzmann Society. The SFB would build on Vienna’s longstanding reputation in the field of JAK-STAT signalling (www.jak-stat.at), extending its scope to address key issues in chromatin function. The results will pave the way for novel therapeutic possibilities, especially with regard to personalized medicine.	Austrian Science Fund FWF	Special Research Programmes SFB	1598520.0	EUR
68	Ao. Prof. Dr. Karl KUCHLER	Medical University of Vienna	None	2018-10-01	2022-09-30	Molecular and Cellular Control of Tissue Homeostasis in Health and Disease - TissueHome	The doc.funds “TissueHome” will implement a new program devoted to the competitive training of 12 PhD students in translational research, addressing fundamental questions related to molecular mechanisms of immune surveillance that maintain tissue homeostasis. A better understanding of molecular principles governing tissue homeostasis in health is needed for efficient therapeutic interventions. However, many questions concerning molecular principles of cell-cell communication, long-range immune signaling, and recruitment of effector cells to ensure normal tissue homeostasis remain open. The central hypothesis of the working program is that malregulation of complex communication signals between immune cells derange the physiological tissue control, thus promoting inflammatory diseases, autoimmune diseases, as well as microbial infections. Thus, TissueHome will decipher how the dynamic communication between innate and adaptive immune cells at epithelial barriers shapes the immunological competence, which is required for protection against infections, autoimmune diseases but also for tolerance to commensal pathogens of the microbiome. TissueHome will address three major questions: (i) How does the dynamic cross-talk of innate–adaptive immunity engage regulatory mechanisms (chromatin modifications / epigenetics, RNA modification, (post)-transcriptional & post-translational) to establish tissue homeostasis in physiology and diseases? (ii) What are the mechanisms innate phagocytes and adaptive T cells use to communicate within microenvironments of epithelia during beneficial/detrimental tissue homeostasis? (iii) How do host-pathogen interactions of microbial pathogens with innate / adaptive immune cells shape the inflammatory response and how can hyperinflammation alter mucosal microbiomes, and how can microbiome dysbiosis promote disease susceptibility? The TissueHome faculty encompasses a team of scientists enjoying international recognition, including leading experts in immune signaling, epigenetics, RNA modification, fungal infectious diseases, autoimmune disesase, molecular medicine, animal genetics, cellular and molecular immunology, host-pathogen interactions, systems biology, gene regulation and bioinformatics. The faculty members have competitive track records in both research and training of PhD students. The TissueHome training will entail state-of-the art methods, including genomic and genetic technologies, next generation sequencing technologies, high-end imaging, animal models and mouse genetics, and immune cell technologies to decipher the molecular mechanisms orchestrating tissue barrier function. The added value of TissueHome is reflected by the integration into the existing MFPL PhD program, with reciprocal benefits due to interdisciplinarity and translational approaches taken by TissueHome, but also by a new and timely topic introduced into the MFPL PhD program. Another added value is that each main aim will be addressed by two to three PhD students through hypothesis-driven collaborative projects. Taken together, TissueHome will (i) offer PhD students to work on interdisciplinarity / translational projects of medical relevance in excellent research environments, (ii) provide a stimulating international environment for research and transferable skills training, and (iii) prepare the PhD students for a successful career in academia, industry or in science-related sectors.	Austrian Science Fund FWF	None	1478840.0	EUR
69	Dr Sandrine Geranton	University College London	Unlisted	2012-04-01	2016-10-07	Epigenetic modifications and their contribution to persistent pain states	Persistent pain, whether caused through injury, disease or surgery, is usually temporary but involves adaptations in the spinal cord nociceptive circuitry, including central sensitization of dorsal horn neurons. This is a complex process that effectively amplifies incoming signals to prevent further damage while the body is repairing. These changes are supported by specific patterns of gene expression that are dynamic and evolve with time. Sometimes the pain persists after the injury has resolved and becomes a chronic pain state indicating maintained sensitization of spinal cord nociceptive networks. Could this be due to aberrant epigenetic modifications? Epigenetic modifications such as DNA methylation and chromatin remodelling regulate high-order chromatin structure crucial to the regulation of gene expression. Epigenetic processes imprint environmental experiences such as social interactions onto the fixed genome and therefore provide a bridge between the genes and the environment by refining neural networks according to experience. These processes are dynamic and reversible but can also result in stable alterations. Their de-regulation has been associated with a broad spectrum of neurological disorders. I will investigate the epigenetic processes that contribute to gene repression and activation in dorsal horn neurons in a model of joint inflammation. 1) DNA methylation is known to inhibit gene transcription. I will investigate DNA methylation status of a small number of genes previously identified. 2) Post-translational modifications of histone proteins, specifically at residues known to modify neuronal network function, regulate access to DNA. These modifications will be mapped onto nociceptive pathways during different phases of joint inflammation. 3) Descending controls from the brain and early life injury modulate pain behaviour. I will look at how descending controls and early life injury can regulate DNA methylation and histone modifications and I will investigate the correlation between epigenetic changes and pain behaviour. 4) Finally, to strengthen this correlation, I will modulate the expression of selected genes under epigenetic controls during joint inflammation and analyse their contribution to the pain state. This will include the investigation of micro-RNAs predicted by gene expression analysis and thought to fine tune neural circuits. This investigation will provide insights into the complex roles of epigenetics in central nervous system plasticity and set the stage for a deeper understanding of the molecular changes that contribute to chronic pain, an area of immense unmet clinical needs.	Medical Research Council	Research Grant	472543.0	GBP
70	Professor Owen Sansom	Beatson Institute for Cancer Research	None	2009-11-01	2009-11-30	AICR's 30th Anniversary Conference - Today's Research, Tomorrow's Therapies 7 - 9 April 2010	The conference is a major gathering for scientists working to illustrate how development in basic research can feed through to translational studies and the important role of model systems in both areas of cancer research. It is expected to attract around 200 residential scientific delegates, with a further 150 corporate and invited guests, from all over the world. The conference will attract some of the best cancer researchers in the world. The first session will focus on fundamental cancer research with papers from leading researchers (including a number of CRUK funded researchers) in current cutting edge fields, including Hans Clevers, an expert in cancer stem cells research, Christer Betsholtz, a leading figure in angiogenesis and Guy Kroemer, a world leader in autophagy and metabolomics. The model systems session starts with Owen Samson, regarded as one of the bright young stars of transgenic technology; Terry Rabbitts, a leading authority in models of chromosome translocation cancers; and Alan Balmain, a recognised expert on oncogenes. The translational research session features Fran Balkwill, an international authority on ovarian cancer and the role of cytokines; Bob Brown, respected for his work on drug development and epigenetics; and Richard Marais, well known for his work on the Ras oncogene and developing drugs for skin cancer.	Cancer Research UK	Conference & Meeting Support Award	None	None
