22	Dr Hannah Long	University of Oxford	None	2015-02-01	2020-01-31	Understanding the conformation and function of enhancer-promoter interactions that drive gene regulation during neural crest development.	I aim to understand the dynamics and importance of promoter-enhancer looping in the regulation of developmental gene expression. The first goal will be to map distal regulatory elements which physically interact with the promoters of important human neural crest-specific genes using Capture-C. Together with pre-existing epigenomic annotation of neural crest enhancers, this will generate a comprehensive view of putative active enhancer elements for these genes. To dissect their functional importa nce, I propose to genetically ablate identified enhancer loci, initially focusing on four regions identified within the SOX9 gene desert at a locus implicated in human craniofacial malformation. Analysis of promoter-enhancer looping interactions has thus far been limited to fixed material, I therefore aim to monitor the dynamics of these interactions in real-time to understand the importance of looping in transcriptional regulation. I will therefore establish a cell line for live imaging of p romoter-enhancer looping in relation to gene expression at stages of human neural crest development by fluorescently labelling the enhancer, promoter and mRNA of the SOX9 gene. Together this proposal will help elucidate the mechanisms by which distal regulatory elements modulate gene expression, and may shed light on how mutation of enhancer elements contributes to congenital disease.	Wellcome Trust	Sir Henry Wellcome Postdoctoral Fellowship	250000.0	GBP
23	Dr Michael Weedon	University of Exeter	University of Exeter Medical School	2014-11-30	2017-11-29	Identifying non-coding mutations in early-onset diabetes	We aim to use whole genome sequencing and epigenomic annotation to identify new non-coding causes of monogenic early-onset diabetes. From our cohort of 3000 genetically undiagnosed MODY patients, we will select the 250 most likely to have a monogenic cause of their disease. To do this we will use a validated probability calculator that assigns a likelihood of a patient having MODY by integrating various clinical criteria and biomarker information. We will ensure that coding mutations in all known monogenic diabetes genes are excluded using a targeted sequencing assay of the exons and minimal promoters of these genes. Whole genome sequencing will be performed on at least 100 of the remaining patients. Initially we will test for previously undetectable mutations at known monogenic diabetes genes, as whole genome sequencing provides the opportunity to identify structural, copy number and deep intronic cryptic splice variants. We will test for cis-regulatory mutations by integrating the whole genome sequencing data with epigenomic annotation from two cell types that are key to diabetes, pancreatic islets and pancreatic progenitor cells. We will test whether unrelated families share novel variants in active regulatory elements. We have successfully validated this approach by identifying mutations in an enhancer 25kb downstream of PTF1A as the commonest cause of isolated pancreas agenesis. Genome-wide analyses will be performed to look for regulatory elements at novel genes, as some genes may only cause MODY-like diabetes if tissue-specific regulatory elements are mutated. To prove causality of any particular variant we will test for co-segregation within families, and we will sequence the putative regulatory element in our remaining MODY cohort and patients from our world-wide network of collaborators. For any variant with convincing genetic evidence, we will perform functional studies in cultured human cells and in vivo using transgenesis in zebrafish.	Medical Research Council	Research Grant	556689.0	GBP
24	Professor Patrick Chinnery	Newcastle University	Institute of Genetic Medicine	2015-04-30	2018-04-29	Newcastle University Single Cell Functional Genomics Unit (NUSCU)	Foundations for the Newcastle University Single Cell Functional Genomics Unit are already in place, incl >£1M investment in 2012-13 in 18-colour fluorescent cell sorting (FACSAria Fusion), analysis (LSRFortessa), image flow cytometry (Image Stream), quantitative multiplex RNA analysis (Nanostring), and >£75K/yr on personnel and maintenance. Although this enables the isolation of cell types and a limited number of functional analyses, the comprehensive analysis of the whole genome, transcriptome, epigenome and a substantial component of the cell proteome is not currently possible in the North East of England. We seek to enable the work described above, through: (i) isolation of single cells from tissue section and suspension for whole genome sequencing and gene expression studies; (ii) in-house whole-genome DNA and RNA sequencing and linked epigenetic analysis; (iii) high throughput single-cell proteomics; (iv) a dedicated bioinformatic infrastructure. It is critical to establish this equipment on-site, as the research proposed will use patient tissue or fragile stem cell populations/cell lines which cannot be transported. We request Cell and sub-cellular trapping from solid tissues by laser micro dissection with optical tweezers (Zeuss PALM CombiSystem) Single-cell targeted gene expression analysis, global transcriptome analysis, mRNA sequencing, and genome amplification for whole-genome sequencing (Fluidigm C1 & BioMark system) Whole genome and transcriptome next-generation sequencing and linked epigenetic analysis (Illumina HiSeq 2500, linked sample preparation equipment, robotics and qPCR validation of RNAseq data) High throughput single cell proteomics with mass spectrometry based cytometry (Cytometry by Time Of Flight, CyTOF) Dedicated computational and bioinformatic infrastructure, enabling data processing and storage using newly developed algorithms (5 high-performance computer nodes @1TB/32core), which will complement our existing computing infrast	Medical Research Council	Research Grant	172200.0	GBP
25	Professor Jonathan Mill	University of Exeter	University of Exeter Medical School	2015-04-01	2016-03-31	Accelerated discovery of functional non-coding genomic variation using single molecule real-time (SMRT) sequencing.	We are requesting funds to develop our genomic sequencing infrastructure, primarily through the acquisition of a Pacific Biosciences single molecule real-time (SMRT) sequencing system, making us one of only a handful of institutes in Europe to have such capability. This system will enable us to assay, identify and analyse regions of the genome hidden from current methods for gene discovery, and facilitate research into the functional mechanisms involved in disease. The Pacific Biosciences RS II SMRT Sequencing System provides the highest consensus accuracy and longest read lengths of any sequencing technology; current average read-lengths are >8.5kb (with a maximum of ~50kb). SMRT sequencing will facilitate advances in disease characterisation, stratification and diagnosis via its unique utility for de novo assembly across highly complex regions of the genome, targeted re-sequencing, long-range phasing of genetic variation, and epigenomic analysis via the direct allele-specific detection of modified DNA bases. We will also develop our High-Performance Computing/Informatics Infrastructure to enable the storage, analysis, alignment, and assembly of SMRT sequencing data. This infrastructure investment will enable the world-leading genetic and epigenetic research groups at the University of Exeter Medical School to further develop their innovative program of clinical genomic research in human disease, with a specific focus on diabetes and neurological phenotypes.	Medical Research Council	Research Grant	50000.0	GBP
26	Professor Andrew Prentice	MRC Unit, The Gambia	None	2015-04-01	2020-03-31	Impact of maternal diet on the epigenome and potentially modifiable effects on offspring health	We have discovered that methylation at a key region affecting an imprinted gene expressing a non-coding RNA (VTRNA2-1 also termed nc886) is strongly affected by the season at which a baby is conceived. The evidence points to variations in maternal diet (and hence a mother’s methyl donor metabolome) as being responsible; when methyl donor supply is poor, resulting in a displacement of the intermediary pathways driving methylation (especially the SAM/SAH ratio), there is a higher frequency of offspring showing loss of imprinting. This project has 3 key aims: Aim 1: Extend our analysis of VTRNA2-1 methylation to include 700+ additional mother/infant pairs to better characterise the periods of critical exposure. This will help to refine our insights into the maternal nutritional exposures responsible for loss of imprinting. We will extend our analysis of the maternal methyl donor metabolome to an additional 350 mothers and an extended panel of nutrients and intermediary markers. We will then work with in silico modellers to establish which are the critical drivers of methylation variation; Aim 2: Examine the implications of imprinting or loss of imprinting at VTRNA2-1 on gene expression and cellular function using a recall-by-epigenotype methodology; Aim 3: To design a nutriceutical intervention to prevent disrupted DNA methylation. This aim will be based on insights gained from Aim 1 and will perform small scale preliminary interventions in small groups of non-pregnant women in preparation for anticipated large scale trials.	Medical Research Council	Research Grant	840787.0	GBP
27	Professor Terence Jones	University of Liverpool	None	2015-11-01	2020-10-31	CRUK/13/025: Pathos -T: A bioresource collection associated with PATHOS, a Phase II/III trial of risk-stratified, reduced intensity adjuvant treatment in patients undergoing transoral surgery for human papillomavirus (HPV)-positive oropharyngeal cancer	Background: Pathos-T is an application for a sample collection associated with the CTAAC funded PATHOS trial - a phase II/III trial for patients undergoing Transoral Laser Microsurgery or Transoral Robotic Surgery and neck dissection for HPV+ve oropharyngeal cancer. The study aim is to reduce the late swallowing side-effects of treatment by de-intensifying post-surgery adjuvant treatment, in a risk-based way. In the phase II study, 218 UK patients will undergo surgery over 3 years. The phase II will roll into a phase III study of ~800 patients powered for survival. Recruitment into Pathos will begin in February 2015. Aims: This sample collection proposal is for 60 months to establish a unique central bio-bank of matched blood samples, fresh (1-5 separate biopsies from the primary tumour and 1-2 from cervical lymph nodes) and paraffin-embedded tumour samples from the 218 patients undergoing surgery in phase II, stored to GCLP standard. Methods: Using RNAseq and ChIP seq analysis and targeted gene sequencing of fresh tumour samples and IHC analysis of FFPE tissue as well as serology and cfDNA analysis of blood, a planned programme of translational research, for which additional funding will be sought, will include the following workstreams 1. An investigation of the tumour/ host immune synapse. 2. An investigation of the prevalence and consequences of viral genome integration and gene expression, in terms of host gene expression and clinicopathological phenotype. 3. The development of tissue based `omics fingerprints of tumour phenotype and risk stratification. 4. The development of clinically relevant blood based biomarkers of treatment response. 5. An investigation of the impact of intra-tumour heterogeneity How the results of this research will be used: Pathos-T offers us the opportunity to accumulate a unique bioresource collection, of world-wide significance, from a homogeneous patient group presenting with a a new and distinct disease which has reached epidemic proportions throughout the Developed World and about which, little is yet known. Specifically, our planned research will allow us to 1. Enhance our knowledge of the immune synapse in patients with HPV+OPSCC and how this interface is influenced by viral gene expression, in order to define poorly performing patient groups and unmask novel drugable targets for future immunotherapeutic strategies. 2. Define risk- stratifying tumour specific transcriptomic and epigenomic fingerprints. 3. Develop clinically applicable prognostic and predictive liquid biomarkers	Cancer Research UK	CTAAC - Sample Collection	None	None
28	Dr. Ludovic Orlando	Københavns Universitet	None	2016-08-01	2021-07-31	The makeup of the modern horse: a history of the biological changes introduced by human management	The horse provided us with rapid transportation, an almost unrivaled secondary product that tremendously impacted the politico-economical trajectory of our societies, revolutionizing the circulation of ideas, people, languages, religions and communication. Horse chariotry and cavalry also changed warfare and beyond the battlefield new equestrian technologies have stimulated agricultural productivity. However, the 5,500 year long history of horse domestication and management, which transformed the natural evolutionary trajectory of wild horses into the more than 625 domestic breeds living today, is difficult to reconstruct from archaeology, history and modern genetics alone. Yet, with archaeogenetics, one can access the genetic information from past individuals and track in great detail past population trajectories. In this project, I propose to build on the latest advances in the analysis of ancient DNA molecules to gather new genomic, epigenomic and metagenomic information from ancient horses. This will be integrated with archaeozoological, isotopic and historical data to enhance our understanding of the multiple processes underlying the transformation of the animal that perhaps most impacted our history. Starting from the characterization of pre-domestic populations of wild horses, I will evaluate the genomic and dietary impact of early domestication stages and will explore whether horses were independently domesticated in Iberia and the Pontic-Caspian steppe. I will follow how the emergence of chariotry and the development of heavy cavalry impacted the horse’s behavioural, physiological and biological makeup. I will reveal the horse characteristics that were preferred in various historical contexts and will investigate a diversity of management strategies and husbandry conditions to reveal their impact on horses, from classical and late antique periods until the recent creation of modern breeds by means of intensive selective breeding.	European Research Council	Consolidator Grant	1999555.0	EUR
29	Prof Jorge FERNANDES	UNIVERSITETET I NORDLAND	None	2016-05-01	2021-04-30	INNOVATIVE EPIGENETIC MARKERS FOR FISH DOMESTICATION	Aquaculture is the fastest growing food production sector in the world, since there is an increasing demand for fish protein to feed a growing global population, which cannot be met by fisheries. In order to ensure the sustainability of this sector it is critical to domesticate and selectively improve the major commercial fish species. To date, the genetic markers used in selective breeding of fish account only for a fraction of the observed phenotypic variation. EPIFISH is a scientifically innovative and timely project that will address fish domestication and selection from a new perspective using a multidisciplinary approach. The rapid pace of substantial phenotypic changes during adaptation to new environmental conditions in fish undergoing domestication raises the original hypothesis that epigenetic mechanisms are involved in this process. Thus, the overarching aim of EPIFISH is to ascertain the importance of epigenetics in fish domestication using the Nile tilapia (Oreochromis niloticus) as model species. Specific objectives are i) to determine how selection affects the miRNA transcriptome and the epigenetic landscape during domestication, ii) to perform a functional characterization of miRNA variants and epigenetic alleles associated with growth, and iii) to validate them as potential epigenetic markers for future selective breeding programmes. The identification of epigenetic markers will be a ground-breaking element of EPIFISH with major impact on aquaculture biotechnology, since they will enable the development and application of epigenomic selection as a new feature in future selective breeding programmes. Moreover, the project outcomes will provide novel mechanistic insights into the role of epigenetics in fish domestication, which will surely open new horizons for future frontier research in epigenetics, namely transgenerational inheritance and nutritional epigenetics.	European Research Council	Consolidator Grant	1997170.0	EUR
30	Prof. Dirk Schübeler	Friedrich Miescher Institute for Biomedical Research	None	2016-01-01	2020-12-31	Readout of DNA methylation	DNA and chromatin modifications are essential for proper control of gene expression during development. How these marks alter transcriptional programs and modulate binding patterns of sequence specific transcription factors (TF) remains poorly understood. This currently limits our interpretation of epigenomic maps towards their incorporation into predictive models of gene regulation. ReaDMe has the ambitious goal to systematically define the sensitivity of TFs to local levels of DNA methylation in vivo. We will use a combination of genomics, genome editing and proteomics tools to comprehensively identify transcriptional regulators that respond to DNA methylation. As a first approach, we will interrogate changes in the global TF binding landscape when DNA methylation is ablated from the genome. Using both embryonic stem cells and somatic cells, these experiments are aimed at identifying sites that are occupied by TFs in a DNA methylation dependent manner within different cellular context. Secondly, we will combine parallelized chromosomal insertions with targeted footprinting to determine the link between DNA sequence context, methylation density and TF binding. In a third approach we will define the global chromatin proteome as a function of DNA methylation. Through the use of a novel and orthogonal proteomics assay, we will characterize DNA methylation sensitive changes in the chromatin-bound proteome. Candidate factors predicted from all approaches will be validated and functionally characterized through direct genome-wide mapping as well as loss of function analysis. ERC funding would enable ReaDMe to develop an integrated setup to in vivo identify and characterize where DNA methylation influences the cis-regulatory landscape by modulating binding profiles of trans-acting factors. This goal represents a crucial step towards comprehensive understanding of the genomic readout of DNA methylation and its impact on gene regulation.	European Research Council	Advanced Grant	2136969.0	EUR
31	Dr Jan Zylicz	University of Cambridge	None	2016-07-01	2020-06-30	Role of epigenetic mechanisms in random X chromosome inactivation ex vivo and in vivo.	Developmental progression is linked to accumulation of epigenetic information mainly in the form of chemical modifications of the chromatin. One of the most striking examples of that is random X chromosome inactivation (XCI) in female mammalian embryos. This process is dependent on coating of one X chromosome by a long non-coding RNA, Xist. This in turn promotes rapid and dramatic remodelling of the chromatin. The functional relevance and exact spatio-temporal dynamics of this process remains elusive. Here I propose to address these questions by using an integrated approach. Firstly I will use an ex vivo embryo culture system to monitor the dynamics of XCI. I will further integrate that information with single cell and population based epigenomic to generate in vivo and in vitro datasets accounting to a roadmap for XCI. I aim at identifying the initial stages of epigenetic programming leading to transcriptional repression as well as genomic loci involved in nucleating these changes. I will finally address the functional relevance of X chromosome epigenetic programming by using gene knockout models and genome-wide single cell transcriptomics approach. Such work will have wide-raging implications beyond the field of XCI and can be extrapolated into other epigenetic regulatory mechanisms.	Wellcome Trust	Sir Henry Wellcome Postdoctoral Fellowship	250000.0	GBP
32	Dr. Simon Elsässer	Karolinska Institute	None	2017-01-01	2021-12-31	Chromatin dynamics resolved by rapid protein labeling and bioorthogonal capture	Histone proteins provide a dynamic packaging system for the eukaryotic genome. Chromatin integrates a multitude of signals to control gene expression, only some of which have the propensity to be maintained through replication and cell division. For our understanding of cellular memory and epigenetic inheritance we need to know what features characterize a stable, heritable chromatin state throughout the cell cycle. State-of-the-art methods such as ChIP-Seq provide population-based snapshots of the epigenomic landscape but little information on the stability and relative importance of each studied feature or modification. This project pioneers a rapid, sensitive and selective protein labeling method (termed RAPID) for capturing genome-wide chromatin dynamics resolved over a period of time ranging from minutes to days. RAPID introduces a flexible time dimension in the form of pulse or pulse-chase experiments for studying genome-wide occupancy of a protein of interest by next-gen sequencing. It can also be coupled to other readouts such as mass spectrometry or microscopy. RAPID is uniquely suited for studying cell cycle-linked processes, by defining when and where stable ‘marks’ are set in chromatin. I will employ mouse embryonic stem cell (mESC) as a model system for pluripotency and lineage specification. RAPID will define fundamental rules for inheritance of histone and other chromatin-associated proteins and how they are modulated by the fast cell cycle of pluripotent cells. Using RAPID in combination with other state-of-the art genetics and epigenomics, I will collect multi-dimensional descriptions of the dynamic evolution and propagation of functionally relevant chromatin states, such as interstitial heterochromatin and developmentally regulated Polycomb domains.	European Research Council	Starting Grant	1846360.0	EUR
33	Dr Paul Martin	University of Manchester	Arthritis Research UK Centre for Genetics and Genomics	2018-08-01	2021-07-31	Using bioinformatics to link disease associations with epigenomic resources to uncover cell type specific rheumatoid arthritis risk	Although genome-wide association studies (GWAS) have been successful in identifying variants that increase the risk of disease, the translation of these findings to clinical benefit has proved more elusive. This is partially due to the, rather surprising, discovery that the vast majority of DNA changes associated with disease are found in ‘non-coding’ regions of the genome, often some distance from the nearest gene. These regions are therefore more likely to regulate gene expression which has been shown to vary across different cell types, stimuli and timepoints. Therefore, the next task to allow full utilisation of GWAS findings, is to determine how these non-coding regions increase the risk of disease. My projects key goals are to link GWAS findings in rheumatoid arthritis (RA) to the genes they regulate, the cell types where this regulation takes place and the mechanisms by which different genetic backgrounds increases the risk of disease. I am in a strong position to achieve this, given my skills, background in bioinformatics and the enormous wealth of data now available, both publicly in general cell types, and more specifically in cell types and conditions pertinent to RA, (e.g. patient T cells, fibroblasts, cartilage) which have been generated within the group. I will utilise both public and in-house generated epigenomic data (e.g. Hi-C, ChIP and ATAC-Seq), showing how regulatory regions of DNA are active in different cell types and conditions, link this to DNA interaction data, providing a physical indication of the genes that are regulated, and expression data to score enhancers for every RA region in each cell type. Overlaying our GWAS variants onto this model will provide the next, crucial step in assigning genetic risk of disease to genes, cell type and mechanism.	Versus Arthritis	Foundation Fellowship	202930.0	GBP
