116	Kathrin Meyer	Children's Research Institute	Children's Research Institute	2012-08-01	2014-02-28	Direct conversion of human patient skin fibroblasts into astrocytes to model sporadic Amyotrophic Lateral Sclerosis	Neurodegenerative diseases such as Alzheimer’s disease, Parkinson’s disease or Amyotrophic Lateral Sclerosis (ALS) account for 14% of all neurological disorders. Most of them occur with no family history and no known cause. Aging is a major risk factor for most of these diseases, therefore they gain increasing attention since the life span of mankind is improving. As the causes are unknown, it is generally difficult to model such conditions in animals or cell culture to study pathogenic mechanisms or to test potential therapeutic strategies. From the central nervous system (CNS), tissue samples can only be removed when the patient reaches the end stage. Due to these difficulties, researchers started to make use of the recently developed reprogramming technology that allows reverting human skin fibroblasts to pluripotent stem cells. The generated induced pluripotent stem cells (iPSCs) can then be differentiated in various cell types including the ones found in the CNS. However, reprogramming erases most of the epigenetic memory that is steering the expression of genes and has been demonstrated to be directly involved in adult onset neurodegenerative diseases. Up to now, iPSC lines from patients with different neurodegenerative diseases including ALS have been produced, but once these cells are differentiated into disease relevant cell types, they mostly fail to reproduce the phenotype observed in patients.In 2011, a more direct and faster approach for the generation of neuronal progenitor cells (NPCs) from mouse skin fibroblasts was published, which is presumably also leaving more of the epigenetic memory intact.In the presented study, we want to apply this approach to human skin fibroblasts from sporadic ALS patients in order to establish a rapid method to produce astrocytes and model ALS in vitro. My preliminary data demonstrate that with this method, I am able to generate ALS patient derived astrocytes. These cells convey toxicity towards motor neurons in a similar manner as primary human ALS astrocytes and ALS astrocytes derived from post-mortem spinal cord NPCs. This finding is exciting, as astrocytes derived from ALS iPS lines failed to reproduce such pathologic features in several independent laboratories. Thanks to the close collaboration with the ALS clinic at the Ohio State University Hospital, our laboratory now possesses both, iPS lines as well as fibroblasts from the same patient. Having established the direct conversion for human fibroblasts, we are now able to compare astrocytes derived by the two different methods in order to expose disease relevant differences in the transcriptome. Therefore this project is of huge interested for the ALS field, but also for a broad science community working on neurodegenerative diseases, reprogramming or differentiation and epigenetics. Finally, our findings can help to unravel potential new therapeutic targets against this devastating disease.	Swiss National Science Foundation	Fellowships for advanced researchers	None	None
117	Prof Deborah Lawlor	University of Bristol	None	2013-06-01	2018-06-30	Integrative epidemiology for exploring how women’s reproductive health influences cardiometabolic health.	Our aim is to provide the evidence base that will improve treatment success with IVF and enable stratified and effective antenatal care in IVF and spontaneous conceptions (SC). This is important because up to 40% or pregnancies are affected by one or more of miscarriage, stillbirth, hypertensive disorders of pregnancy, gestational diabetes, preterm birth or delivery or a small or large for gestational aged infant, but we do not know the best way of preventing these. IVF is now the commonest treatment for infertility with >250K IVF cycles completed per year in the UK and on average 1 in 30 primary school children were born as a result of in vitro fertilisation (IVF). Success rates vary by couple and treatment characteristics but are between 20-30%. There are suggestions that IVF per se, and pregnancy complications in IVF and SC have important adverse effects on future offspring cardio-metabolic health, but whether these associations are causal and if so their magnitude is unclear. Our objectives are to accurately predict and identify causal paths for: (i) response to IVF; (ii) healthy pregnancy and perinatal outcomes in IVF and SC; and (iii) offspring cardio-metabolic health. Methods Our focus will primarily be on maternal smoking, physical activity, sleep patterns, adiposity, pregnancy metabolic profiles and fetal (cord-blood) DNA methylation as potential predictors or risk factors. We will use data from detailed clinical and general pregnancy/birth cohorts. We will work with relevant consortia, including the EuroCHILD pan-European birth cohort that we are involved in establishing from 26 existing cohorts, early growth genetics (EGG) consortia, in which we co-lead maternal-offspring genetic analyses, the Genetics of Diabetes In Pregnancy (GENdip) consortia that we have recently developed, and the pregnancy/birth cohorts working group aligned to the Consortia Of METabolomics Studies (COMETS), which we lead, as well as the Pregnancy And Child Epigenetics (PACE) consortia, which we work closely with alongside Relton’s MRC Integrative Epidemiology Unit programme. We will triangulate results across the following analytical methods applied to these data sources: multivariable regression (MV), Mendelian randomization (MR), non-genetic instrumental variable (IV) analyses, within sibship and negative control studies. Translation Building on our successful impact on clinical guidelines in the first five-years of this programme, we will continue to work with relevant clinicians, patient groups and NICE guideline developers. For new methodological developments we will provide and share datasets and code and widely disseminate these.	Medical Research Council	Unit	None	None
118	Prof Deborah Lawlor	University of Bristol	None	2018-04-01	2023-03-31	Reproductive and cardio-metabolic health	Our aim is to provide the evidence base that will improve treatment success with IVF and enable stratified and effective antenatal care in IVF and spontaneous conceptions (SC). This is important because up to 40% or pregnancies are affected by one or more of miscarriage, stillbirth, hypertensive disorders of pregnancy, gestational diabetes, preterm birth or delivery or a small or large for gestational aged infant, but we do not know the best way of preventing these. IVF is now the commonest treatment for infertility with >250K IVF cycles completed per year in the UK and on average 1 in 30 primary school children were born as a result of in vitro fertilisation (IVF). Success rates vary by couple and treatment characteristics but are between 20-30%. There are suggestions that IVF per se, and pregnancy complications in IVF and SC have important adverse effects on future offspring cardio-metabolic health, but whether these associations are causal and if so their magnitude is unclear. Our objectives are to accurately predict and identify causal paths for: (i) response to IVF; (ii) healthy pregnancy and perinatal outcomes in IVF and SC; and (iii) offspring cardio-metabolic health. Methods Our focus will primarily be on maternal smoking, physical activity, sleep patterns, adiposity, pregnancy metabolic profiles and fetal (cord-blood) DNA methylation as potential predictors or risk factors. We will use data from detailed clinical and general pregnancy/birth cohorts. We will work with relevant consortia, including the EuroCHILD pan-European birth cohort that we are involved in establishing from 26 existing cohorts, early growth genetics (EGG) consortia, in which we co-lead maternal-offspring genetic analyses, the Genetics of Diabetes In Pregnancy (GENdip) consortia that we have recently developed, and the pregnancy/birth cohorts working group aligned to the Consortia Of METabolomics Studies (COMETS), which we lead, as well as the Pregnancy And Child Epigenetics (PACE) consortia, which we work closely with alongside Relton’s MRC Integrative Epidemiology Unit programme. We will triangulate results across the following analytical methods applied to these data sources: multivariable regression (MV), Mendelian randomization (MR), non-genetic instrumental variable (IV) analyses, within sibship and negative control studies. Translation Building on our successful impact on clinical guidelines in the first five-years of this programme, we will continue to work with relevant clinicians, patient groups and NICE guideline developers. For new methodological developments we will provide and share datasets and code and widely disseminate these.	Medical Research Council	Unit	1640000.0	GBP
119	Dr Renuka Dias	Queen Mary University of London	Unlisted	2007-11-01	2009-10-31	Epigenetic Analysis of the IGF2/H19 locus in the NESTEGGG Small for Gestational Age Population	Small for gestational age (SGA) infants are known to be at increased risk of developing a number of metabolic alterations. Silver-Russell Syndrome (SRS) is a distinct subtype of the SGA population with poor fetal and postnatal growth. A proportion of these patients have duplication in the chromosome 11p15 locus which contains the IGF2 gene. This is known to be important in fetal growth with complex control mechanisms for expression including maternal imprinting and multiple promoters. It has recently been demonstrated that up to 30% of all SRS patients have undermethylation in the IGF2/H19 locus with associated reduced IGF2 expression. The hypothesis is that SRS is a result of IGF2 deficiency which is not necessarily secondary to the methylation abnormalities. The aim of the project is look at the methylation status of various differentially methylated regions in the IGF2-H19 locus using EBV transformed lymphocytes taken from patients enrolled in the NESTEGG study and to compare this with IGF2 expression. Methylation status will be examined using bisulphite treatment of DNA in conjunction with either product subcloning and sequencing or with pyrosequencing. IGF2 expression will be quantified using real-time TaqMan assay. An IGF2 ELISA assay will be used to compare protein expression to investigate translation of message. If IGF2 deficiency is more widespread compared to methylation abnormalities, alternative pathogenic mechanisms such as defective promoter function or abnormal histone acetylation and methylation will be investigated. If IGF2 deficiency is shown to be exclusive to those patients with methylation abnormalities, the IGF2 receptor epigenetics and function will be investigated further. Although poor fetal growth is known to have significant effects on cardiovascular risk in adulthood it remains a poorly understood and clinically heterogeneous phenomenon. This project aims to further understand the role that IGF2 and epigenetics may play in poor fetal and postnatal growth.	Medical Research Council	Fellowship	131628.0	GBP
120	Dr. Anja Groth	Københavns Universitet	None	2011-11-01	2016-11-01	How to Replicate Chromatin - Maturation, Timing Control and Stress-Induced Aberrations	Inheritance of DNA sequence and its proper organization into chromatin is fundamental for eukaryotic life. The challenge of propagating genetic and epigenetic information is met in S phase and entails genome-wide disruption and restoration of chromatin coupled to faithful copying of DNA. How specific chromatin structures are restored on new DNA and transmitted through mitotic cell division remains a fundamental question in biology central to understand cell fate and identity.Chromatin restoration on new DNA involves a complex set of events including nucleosome assembly and remodelling, restoration of marks on DNA and histones, deposition of histone variants and establishment of higher order chromosomal structures including sister-chromatid cohesion. To dissect these fundamental processes and their coordination in time and space with DNA replication, we have developed a novel technology termed nascent chromatin capture (NCC) that provides unique possibility for biochemical and proteomic analysis of chromatin replication in human cells. I propose to apply this innovative cutting-edge technique for a comprehensive characterization of chromatin restoration during DNA replication and to reveal how replication timing and genotoxic stress impact on final chromatin state. This highly topical project brings together the fields of chromatin biology, DNA replication, epigenetics and genome stability and we expect to make groundbreaking discoveries that will improve our understanding of human development, somatic cell reprogramming and complex diseases like cancer. The proposed research will 1) identify and characterize novel mechanisms in chromatin restoration and 2) address molecularly how replication timing and genotoxic insults influence chromatin maturation and final chromatin state.	European Research Council	Starting Grant	1692737.0	EUR
121	Prof Jorge FERNANDES	NORD UNIVERSITET	None	2018-09-01	2020-02-29	Commercial feasibility of a kit for the identification of epigenetic markers in farmed fish	Domestication and selective breeding of the major commercial fish species are essential to enable sustainability of the rapidly expanding aquaculture sector. The existing improvement programmes are based exclusively on genetic markers, overlooking the fact that selection for complex traits is strongly affected by environmental conditions and that epigenetics likely account for a large proportion of the observed phenotypic variation. Non-coding RNAs (e.g., miRNAs) and cytosine methylation (5mC) and hydroxymethylation (5hmC) of DNA are key mechanisms underlying epigenetic regulation of gene expression. We have recently identified a panel of 5mCs, 5hmCs and miRNAs that are potential epigenetic markers (epimarkers) of improved growth in Nile tilapia (Oreochromis niloticus). EPIMARK will evaluate the commercial feasibility of our novel kit of growth epimarkers, so that they can be applied in selective breeding programmes. This will be achieved by (i) validating the miRNA, 5mC and 5hmC epimarkers, (ii) developing an assay for their quantification, (iii) investigating the commercial and financial feasibility and (iv) developing the optimal business strategy, consolidated in a business plan. The EPIMARK kit will lead to a more efficient selection of fish in breeding programs based on growth potential, thereby increasing the profitability and sustainability of the aquaculture industry. The technology developed in EPIMARK will also open important avenues of innovation, including the use of epimarkers for selection of other superior production traits and disease resistance in Nile tilapia and in other species of commercial importance.	European Research Council	Proof-of-Concept Grant	149203.0	EUR
122	Dr Fieke Froeling	Imperial College London	None	2015-02-01	2020-02-29	Mechanisms of epigenetic regulation of drug resistance in pancreatic cancer	Pancreatic cancer is a highly lethal disease that is resistant to almost all available therapies. Overall five-year survival has remained less than 5% over the last 50 years and is the lowest of the 21 most common cancers in England. It is characterised by a dense fibrotic stroma with activated pancreatic stellate cells (PSCs). In addition to genetic changes, it is now increasingly recognised that epigenetic mechanisms play a major role in cancer development and drug resistance. Epigenetics can be defined as heritable changes in gene expression without a change in DNA sequence. Epigenetic control of gene expression can be via chemical alteration of the DNA (usually by methylation of cytosines) or through modifications of histones (proteins that pack the DNA into chromatin, the main component of chromosomes). Little is known about epigenetic mechanisms that are important in pancreatic cancer. The aim of this study is to identify key epigenetic drivers of chemotherapy resistance in pancreatic cancer. Using techniques to search the whole genome for histone modifications, I will study the changes in pancreatic cancer cells that show a differential response to chemotherapy. Since the tumour stroma also plays a major role in pancreatic cancer, I will also study the epigenetic mechanisms that drive the change of PSCs from a quiescent to an activated phenotype, using similar techniques as for pancreatic cancer cells. This project will provide important data to work towards our long-term aim to identify targets for novel therapeutic strategies in pancreatic cancer.	The Academy of Medical Sciences	Starter Grant for Clinical Lecturers	28305.0	GBP
123	Dr. Ketting	Koninklijke Nederlandse Akademie Van Wetenschappen (Knaw)	None	2008-08-01	2013-08-01	Small RNA Mediated Epigenetics in Vertebrates	Since the discovery of RNAi small RNA molecules have been under intense study. They have been shown to impact many different processes, ranging from development to organ function and carcinogenesis. Recently it has become clear that many distinct small RNA families exist. However, all act though a member of the well-conserved Argonaute family of proteins. I try to understand how specificity of the different Argonaute proteins is achieved, and I am particularly interested in Argonautes that may contribute to the epigenetic marking of genomic DNA in animals. My focus is on Argonaute function in the vertebrate germline, a tissue that is an especially intriguing system with regard to the resetting and establishment of epigenetic marks. As model system I use the zebrafish.Piwi proteins are Argonaute proteins that in vertebrates are specifically expressed in germ cells, and have been implicated in modifying chromatin structures. We demonstrated that zebrafish piwi is expressed in both the male and the female gonad and that loss of piwi results in loss of germ cells due to apoptosis. We have characterized small RNAs that bind to piwi (piRNAs) in both ovary and testis, and found that they play a role in the silencing of transposable elements. Furthermore, we have shown that the biogenesis of piRNAs differs markedly from that of other small RNAs like miRNAs.The experiments I propose address how Piwi proteins and piRNAs act in the germline to ensure a functional germline and a stable propagation of intact chromatin over generations. First, we will address the biogenesis of piRNAs. Second, we will identify novel components of the Piwi pathway. Third we will address the mode(s) of action of piRNAs. On all fronts a combination of genetics, molecular biology and biochemistry will be used.	European Research Council	Starting Grant	970000.0	EUR
124	Dr. Florian RAIBLE	University of Vienna	None	2019-10-01	2023-09-30	SCORPION: Stem Cells, Tissues, Organoids – Dissecting Regulators of Potency and Pattern Formation	The Vienna BioCenter (VBC) PhD programme is one of the most outstanding European PhD programmes in the life sciences. It enables students to directly engage in frontier research. Participating faculty has acquired a total of 43 ERC grants in the life sciences, and VBC PhD students have co-authored milestone publications like the discovery of tracrRNA, the Cas9/CRISPR mechanism or the establishment of cerebral organoids from human pluripotent stem cells. Founded in 1993, the programme has produced a strong track record of graduates that have accepted leading positions in science, science management or private research. Moreover, the VBC PhD programme developed a thorough training and education programme that builds on the PhD curriculum for life sciences of the University of Vienna, from which students obtain their degree. Research into Stem cells and Development is one of the core research areas on the Vienna BioCenter, connecting basic research groups across the different research institutes and faculties participating in the VBC PhD programme. The proposed research in this proposal will strengthen two central research directions of this consortium: (i) The first research direction focuses on cellular programmes and aims to define the molecular mechanisms that drive stem cells to into lineage-specific programmes, or – conversely – permit differentiated cells to de-differentiate. This also includes the question how the homeostasis between stem cells and differentiated cells is regulated on the tissue level. (ii) The second research direction investigates how stem cells form whole tissues, and how this process can be recapitulated and molecularly dissected ex vivo, building on the recent breakthroughs in organoid culture and genome editing. The proposed PhD projects of the consortium match these central research directions, and take full advantage of the excellent research environment available to the students. This covers state-of-the-art facilities, including the newly founded Stem cell core facility (ISCCF) of the Austrian Academy of Sciences that will be a central player for stem cell expertise and training to the consortium. Likewise, the consortium will benefit from the association of a strong bioinformatics group providing and developing methodology for large data analyses. This will meet foreseeable challenges posed by the advent of massive parallel cellular transcriptomics and other high-throughput technologies. Finally, the students will profit from the world-class science performed in interfacing research areas, such as (i) RNA biology, gene regulation and epigenetics (ii) molecular medicine or (iii) neuroscience; and from the list of outstanding scientists that visit the campus as part of the VBC lecture series. Together, this will provide the students funded by this proposal with an excellent training and research environment in which they can mature as scientists, follow their curiosity, and contribute to original research discoveries that will break new grounds in distinct areas of stem cell research.	Austrian Science Fund FWF	None	1712361.19	EUR
125	Professor Marx	Universität Konstanz	None	2014-02-01	2019-02-01	Evolved Replication Systems for Epigenetics	Cells have a broad functional and morphological diversity due to differential gene expression. Research in epigenetics combines the study of inheritable, phenotypical changes in the gene expression pattern of a specific cell type that are not caused by a transformed nucleotide sequence of the genetic code itself. Epigenetic marks are represented by a variety of molecular mechanisms including DNA methylation. Alterations of DNA methylation play a crucial role in the onset of diseases like cancer. Many DNA methylation-based biomarkers have been evaluated and the analysis of epigenetic alterations is a promising tool for disease diagnostics, prognostics, and prediction of drug response. In future, this will allow to adapt therapies to a person, which will increase the chance for successful treatments, minimizing side-effects of chemotherapy and administration of ineffective drugs and thus, prevent the onset of follow-up problems that are associated with these events. Thus, cost-effective but robust means that allow the analysis of DNA methylation-based biomarkers are of urgent need. Several methods for analysis of these biomarkers are employed. However, those that have the required resolution are laborious, time-consuming, and error-prone and thus, prevent broad applications of DNA methylation profiling in clinical diagnostics. The aim of this project is to overcome the barriers that prohibit using DNA methylation profiling in broad clinical applications for diagnostics, prognostics, and prediction of drug response. The objectives will be reached by a multidisciplinary systemic approach harnessing the power of organic synthesis (i. e. new synthetic modified nucleotides), biochemical and structural enzyme studies, and directed evolution of DNA polymerases tailored for new replication systems for epigenetics. The evolved replication systems will be superior to known techniques by superseding the bottle necks of current approaches paving the way for broad applications.	European Research Council	Advanced Grant	2483966.0	EUR
126	Paola Scaffidi	Francis Crick Institute	None	2015-04-01	2021-03-31	Cancer Epigenetics Laboratory	None	Wellcome Trust	None	None	None
