37	Dr. Stefan WINTER	Medical University of Vienna	None	2010-08-01	2012-02-29	Function of CDYL in the regulation of chromatin structure	Within eukaryotic cells the environment for all genomic processes is chromatin. This structural highly dynamic polymeric molecule is composed of DNA and mainly histone proteins. Chromatin can be further divided into transcriptional active euchromatin or transcriptional inert heterochromatin. Post-translational modifications (PTM) of histones appear as key regulators of chromatin function thereby epitomizing the biochemical basis for epigenetic phenomena. One way how PTMs impact chromatin biology is via the recruitment of modification dependent effector proteins which further relay the modification to a particular biologic effect. Methylation of histone H3 at lysine 9 (H3K9) is considered one of the hallmarks of heterochromatin. One novel factor that was demonstrated recently to recognize this modification via a chromodomain is CDYL, indicating a possible function in organization of heterochromatin. This factor was shown to possess transcriptional repressor activity, probably via transient interaction with a repressor complex; however the function of CDYL in chromatin biology is not yet characterized. In this project I will analyze the role of CDYL in chromatin biology via biochemical, biophysical and cell biology approaches. To this end I will determine the subcellular localization of CDYL via fluorescence-microscopy and the chromatin related localization via genome wide mapping approaches. I will accurately analyze thermodynamic parameters of CDYL binding to chromatin and effects of this association on chromatin structure in vivo and in vitro. Further I will investigate consequences of CDYL binding on transcriptional regulation in vivo. To get a comprehensive understanding of CDYL direct and indirect functions in chromatin organization I will identify and characterize CDYL associated proteins as well as RNAs. The impact of these factors on CDYL chromatin-functions will be addressed via biochemical and biophysical methods. I expect the dataset generated from the suggested experiments to significantly expand our knowledge how CDYL may participate in heterochromatin formation.	Austrian Science Fund FWF	Erwin Schrödinger Fellowship	None	None
38	Dr Till Bartke	MRC London Institute of Medical Sciences	None	2011-10-01	2017-09-30	Molecular Mechanisms of Chromatin Regulation by DNA and Histone Modifications and Epigenetic Reader Molecules	Most of the genetic information in eukaryotic cells is stored within the nucleus in the form of chromatin. Two key mechanisms known to regulate the functional state of chromatin in mammals are the methylation of DNA and the post-translational modification of histone proteins. Due to the large number of possible modifications, epigenetic information can be stored in chromatin modification patterns. Chromatin modifications have been shown to regulate all DNA-associated processes, such as transcription, replication, and DNA repair, and play an important role in cell proliferation and differentiation. These functions are intimately linked to the faithful interpretation and inheritance of genetic information and the memory of a cell’s identity. Deregulation of these modifications and their modifying enzymes are implicated in many types of diseases, including cancer and neurological disorders. Many chromatin-regulating factors have been identified that recognise methylated DNA or modified histones. Such effector molecules use a range of different binding domains in order to establish and orchestrate biological events. Since chromatin is a large macromolecular assembly, modifications most likely act in a concerted manner. However, it is still unclear how the information contained in combinatorial modification patterns on the DNA and histones is interpreted. Our aim is to understand how combinations of DNA and histone modifications regulate the activity of chromatin. We employ the tools of chemical biology, biochemistry and proteomics in conjunction with tissue culture and genomic technologies in order to study proteins that can recognise DNA and histone modification patterns in the context of chromatin. We have developed a technique called SILAC nucleosome affinity purification that allows us to identify proteins that bind DNA or histone modifications on in vitro assembled nucleosomes using high-resolution mass spectrometry. We will use this technique for identifying new factors that integrate information contained in multiple chromatin modifications on nucleosomes and chromatin, and for understanding how they operate at the molecular level. We are particularly interested in the molecular mechanisms that underlie epigenetic gene regulation events during DNA replication, tumour formation and differentiation processes. Our research will help elucidate how chromatin modifications regulate cellular processes and how deregulation of normal chromatin function leads to diseases. Our ultimate goal is to identify the critical factors and to understand their molecular and cellular functions in order to develop drugs for epigenetic therapies against diseases such as cancer.	Medical Research Council	Unit	None	None
39	Dr Till Bartke	Imperial College London	None	2013-05-01	2018-05-01	Regulation of Chromatin by Combinatorial DNA and Histone Modifications	The normal expression of genes is tightly regulated. Modifications on histones or on DNA play a central role in the control of gene expression and errors in their regulation often result in diseases such as cancer. These modifications can recruit proteins that regulate chromatin function. Since chromatin is a large macromolecular assembly, modifications most likely act in a concerted manner. However, it is still unclear how the information encoded in combinatorial modification patterns on the DNA and histones is translated into biological signals. My aim is to understand how combinations of DNA and histone modifications regulate the activity of chromatin. I will employ the tools of chemical biology, biochemistry and proteomics in conjunction with tissue culture models in order to identify proteins that can recognise DNA and histone modification patterns in the context of chromatin. I propose to use native chemical ligations to generate a library of histone proteins that carry combinations of modifications that are known to mark specific genomic loci. These histones will be assembled into chromatin together with methylated DNA in order to mimic functional genetic elements such as heterochromatin, promoters or enhancers. I will use the recombinantly defined chromatin in chromatin modification, chromatin remodelling and SILAC affinity purification assays in order to identify novel factors that recognise combinatorial modifications. The SILAC affinity purifications will be linked to a primary cell cancer model in order to identify factors that regulate central tumour suppressor genes. The identified factors will be further characterised in vivo, in vitro and in structural studies in order to understand their molecular function. These experiments will identify factors that can read epigenetic signatures contained in chromatin modification patterns. These constitute the primary targets for ?epigenetic drugs? that intervene at key stages in the development of cancer.	European Research Council	Starting Grant	1629630.0	EUR
40	Dr Manel Esteller Badosa	Fundació Privada Institut D'investigació Biomèdica De Bellvitge	None	2011-04-01	2016-04-01	Epigenetic Disruption of Non-Coding RNAs in Human Cancer	In recent years, my laboratory, as well as others, have established the observation that epigenetic disruption, particularly in the DNA methylation and histone modification patterns, contributes to the initiation and progression of human tumors (Esteller, Nat Rev Genet 2007; Esteller, N Engl J Med 2008; Esteller, Nat Rev Biotech, In Press, 2010). Even more recently, it has been recognized that microRNAs, small non-coding RNAs that are thought to regulate gene expression by sequence-specific base pairing in mRNA targets, also play a key role in the biology of the cell, and that they can also have an impact in the development of many diseases, including cancer (le Sage and Agami, 2006; Blenkiron and Miska, 2007). However, there is little understanding about epigenetic modifications that might regulate the activity of microRNAs and other non-coding RNAs (ncRNAs), such as long non-coding RNAs (lncRNAs), Piwi-interacting RNAs (piRNAs), small-interfering RNAs (siRNAs), transcribed ultraconserved regions (T-UCRs), small nuclear RNAs (snRNAs), small nucleolar RNAs (snoRNAs), long interspersed ncRNAs (lincRNAs), promoter-associated RNAs (PASRs and PALRs) and terminator-associated sRNAs (TASRs) (Calin et al., 2007; Mercer, et al., 2009; Ghildiyal & Zamore, 2009; Jacquier, 2009). Our ignorance in this respect is even more significant if we consider these questions in the domain of cancer. Making best use of our expertise in several of these fields, my group will tackle the study of the epigenetic modifications that regulate ncRNA expression and how the DNA methylation and histone modifications profiles of these loci might become distorted in human cancer. These findings could have profound consequences not only in the understading of tumor biology, but in the design of better molecular staging, diagnosis and treatments of human malignancies.	European Research Council	Advanced Grant	2497240.0	EUR
41	Prof. Oren	WEIZMANN INSTITUTE OF SCIENCE	None	2012-01-01	2017-01-01	RNF20 and H2B ubiquitination: linking chromatin dynamics, transcriptional control and cancer	Chromatin modifications play a major role in regulating genome function. Perturbations in such modifications can contribute to neoplastic processes. We will focus on a specific chromatin modification: histone H2B monoubiquitylation. The significance of monoubiquitylated H2B (H2Bub) will be studied by manipulating RNF20, the major E3 ubiquitin ligase responsible for H2B ubiquitylation as part of a heteromeric complex with RNF40. In one major line of research, we will assess the biochemistry of RNF20/H2Bub. The effects of RNF20/H2B on gene expression will be explored through identification of proteins that interact with H2Bub and through in vitro incorporation of H2Bub into nucleosomes. Effects of H2Bub on transcription elongation will be studied by a new high resolution ChIP-seq method (NET-seq). Based on recent ChIP-seq data, we will also explore links between H2B and regulation of splicing. Furthermore, we will investigate the regulatory crosstalk between H2Bub and microRNAs. The other major line of research will explore the biology of RNF20/H2Bub, with particular emphasis on cancer-related processes. This will be addressed through a combination of cell culture models and mouse models, including constitutive and conditional RNF20 knockout mice. The contribution of RNF20/H2Bub to various differentiation programs, with particular emphasis on embryonic stem cell differentiation, will also be investigated. In addition, we will study the impact of RNF20/H2Bub on NF-kB activity and on inflammatory responses; this will combine in vitro and in vivo systems, with emphasis on inflammation-related cancer. Finally, we will monitor changes in RNF20, RNF40 and H2Bub status in human tumors and investigate underlying mechanisms.	European Research Council	Advanced Grant	2500000.0	EUR
42	Dr Anne Corcoran	Babraham Institute	None	None	2017-01-01	What is the function of antisense intergenic transcription in V(D)J recombination?	V(D)J recombination, the process by which multiple gene segments are recombined together to generate a diverse antigen receptor repertoire, is tightly regulated by differential chromatin opening. How this is achieved in these large multigene loci is poorly understood. We have discovered that antisense intergenic transcription occurs throughout the immunoglobulin heavy chain (Igh) locus in regions poised for V(D)J recombination. We have proposed that this transcription remodels chromatin for VH-to-DJH recombination. The aim of this project is to test this hypothesis by asking: What is the function of antisense intergenic transcription in V(D)J recombination? Our objectives are: (1) To interrupt antisense intergenic transcription in the mouse Igh DJ region in vivo to determine whether it is required for Igh D to J recombination. (2) To analyse the effects of inhibiting transcription on events preceding D to J recombination, to determine how antisense transcription achieves its effects on D to J recombination. (3) To remove antisense transcripts produced prior to D to J recombination, in vitro, to determine the role of these transcript products in D to J recombination separately from the process of transcription. We will achieve these objectives firstly by 'knocking-in' transcription termination cassettes into the DJ region , downstream of two major antisense transcription start sites we have identified. We will determine the effects of transcription loss on D to J recombination using RNA-FISH analysis of primary transcripts in single cells, and DNA-FISH and PCR-based V(D)J recombination assays. If loss of transcription inhibits D to J recombination, we will analyse associated processes including nuclear relocation and histone modification, by DNA-immunoFISH and CHIP, respectively, to determine how antisense transcription exerts its effects. Similar strategies will be used to determine the effects of in vitro loss of antisense transcripts.	Biotechnology and Biological Sciences Research Council	Standard grant	423496.0	GBP
43	Dr. Eleni Marina TOMAZOU	CCRI - CHILDREN'S CANCER RESEARCH INSTITUTE	None	2012-08-01	2014-07-31	Oncogenic fusion proteins & epigenome: partners in crime?	Significance: Cancer is one of the leading causes of death among children in the developed world. Advances in treatment have raised survival rates to 80% for many paediatric cancers, but certain rare tumours including Ewing sarcoma continue to be associated with poor survival. The discovery of epigenetic aberrations in paediatric cancers (such as changes in DNA methylation and histone modification patterns) suggests a promising route toward new therapies. Epigenetic aberrations can be reversed by an emerging class of epigenetic drugs, which are already used for cancer treatment in the elderly. The prospect that epigenetic events may broadly contribute to the development of paediatric tumours opens up exciting opportunities for epigenetic cancer therapy in children. Goal: The project will study epigenetic aberrations with relevance to Ewing sarcoma, a rare paediatric tumour of the bone that lacks satisfactory treatment strategies. Ewing sarcoma is driven by the oncogenic fusion protein EWS/FLI1, thus providing a powerful model for dissecting the interplay of fusion proteins and epigenetic regulation on a genome-wide scale. Innovation: An in vivo mouse transplantation assay will be used to investigate the regulatory networks coordinated by EWS/FLI1. This approach provides a major advance over prior research, which has been restricted to in vitro cancer cell lines. The in vivo assay will provide insights into the chain of regulatory events that lead to carcinogenesis, and it will establish an assay for pre-clinical testing of epigenetic drugs. Approach: Aim 1. Development of a flexible and tractable assay for EWS/FLI1-induced transformation Mesenchymal stem cells (MSCs) are considered the tissue of origin of Ewing sarcoma. An in vivo transplantation assay will be established based on EWS/FLI1-expressing MSCs, which induces transformation and carcinogenesis. This model will be complemented by in vitro assays using both mouse and human MSCs. Aim 2. Identification of epigenetic states and events associated with EWS/FLI1-induced transformation Epigenome mapping of EWS/FLI1-induced tumours will be combined with gene expression and EWS/FLI-binding analysis. Integrated bioinformatic analysis of the resulting dataset will identify candidate epigenetic events relevant for carcinogenesis. Aim 3. Functional characterisation of epigenetic events contributing to EWS/FLI1-induced transformation Potentially causal epigenetic events will be functionally characterized by knock-down and over-expression of epigenetic regulators in vitro. The clinical relevance of these events will be confirmed by epigenetic analysis of human tumour samples and by epigenetic drug treatment of the in vivo mouse model. Alignment with Funding Strategy: The proposed project addresses all three aims of the Lise Meitner program: (i). it enables a scientist trained in world-class labs to pursue a research project at one of Austria’s leading cancer research institutes, while exploiting local expertise in genomic and mouse research through collaborations; (ii). it introduces a new scientific field to Austria; and (iii). it establishes a formal collaboration between an Austrian institute and a leading research institute abroad.	Austrian Science Fund FWF	Lise Meitner Programme	133360.0	EUR
44	Giuseppe Testa	ISTITUTO EUROPEO DI ONCOLOGIA S.R.L., MILANO	DIPARTIMENTO DI ONCOLOGIA SPERIMENTALE	2014-07-01	2016-02-03	Neurodevelopmental alterations in Weaver syndrome: a cell reprogramming-based approach to the elucidation of epigenetic disease mechanisms	Weaver syndrome is a rare and so far neglected disease characterized by overgrowth and intellectual disability associated with craniofacial dismorphism. Weaver syndrome has been recently associated with the genetic defect in a protein, called EZH2, that chemically modifies one of the proteins around which DNA is wrapped within our cells. This protein is called Histone H3, and its modification by EZH2 is important in controlling how genes are expressed during development. However, while much is known about the function of EZH2 in orchestrating development, there is no understanding of how the genetic defect found in Weaver syndrome patients brings about the cardinal manifestations associated to the disease. In particular the role of EZH2 in the function of mature neurons, ie. once the cerebral cortex has completed its development, remains unclear. The aim of our project is to define how the genetic defect of Weaver syndrome causes malfunction or abnormal development of cortical neurons, in order to shed light on the mechanisms responsible for cognitive impairment in Weaver syndrome patients. To this end we use a very innovative technological approach to fill the gap between what is known on the function of EZH2 and the clinical manifestations of this disease. Specifically, we use fibroblasts from small skin biopsies, provided by Weaver syndrome patients, and we reprogram them into pluripotent stem cells which can then be differentiated, in vitro, into cortical neurons. We will perform on these patient-specific cells a wide range of advanced molecular analyses to define what are the key genes whose function is altered as a result of the genetic defects in EZH2. Furthermore, the characterization of pluripotent stem cells from Weaver patients will become an important tool for the Weaver syndrome research community, since these cells can be used to study the effect of Weaver mutations on the full range of cell types involved in the clinical manifestations of the disease.	Telethon Italy	Telethon Exploratory Project	49719.43	EUR
45	Professor Keisuke Kaji	University of Edinburgh	Inst of Stem Cell Research	2007-12-01	2010-11-30	Investigation into the mechanisms of mesendoderm specification during ES cell differentiation	Recently some culture conditions for efficient production of neuroectoderm and mesoendoderm lineages from ES cells have been developed. However, even a small amount of remaining undifferentiated ES cells in these cultures would be a problem for transplantation because ES cells are tumorigenic. This proposal aims to understand the molecular mechanisms and importance of epigenetic modifications in ES cell self-renewal and in the initial steps of ES cell-mesoderm differentiation. Knowledge gained will then be applied to achieve tight regulation of transition between pluripotent cells and the mesoderm lineage in culture. For this purpose, Mbd3 deficient ES cells will be used. Mbd3 is a component of the nucleosome remodeling and histone deacetylase (NuRD) complex and Mbd3 deficient ES cells have severe differentiation defects. In the absence of LIF Mbd3 deficient ES cells begin to express Fgf5, an early ectoderm marker, but maintain expression of the stem cell marker Oct4, without inducing the early mesoendoderm marker, Brachyury. Fgf5 expression can be reversed by culturing in the presence of LIF, therefore although Mbd3 deficient ES cells appear to initiate to differentiation they cannot progress beyond the point from where cells cannot return to undifferentiated ES cells. Interestingly Mbd3 deficient ES cells expressing an Mbd3ER fusion protein, which can be either nuclear or cytoplasmic depending upon the addition of 4-hydroxy tamoxifen (4OHT), can successfully differentiate and begin to express Brachyury in a 4OHT-dependent manner. I will use this system to dissect the gene expression events that occur during these early differentiation steps. To further dissect the initial events of ES cell differentiation I will use a Nanog-reporter gene construct to isolate ES cells expressing low levels of Nanog, which have recently been shown to be poised to differentiate. Gene expression patterns of Nanog-low expressing cells in wild-type and Mbd3 deficient ES cells will be compared in order to provide molecular snapshots of gene expression patterns immediately prior to, and immediately following the initiation of differentiation. From these experiments and subsequent functional analyses, I will be able to identify genes playing important roles in the early stages of ES cell differentiation, particularly towards the mesendoderm lineages. The results of this study will be used to identify conditions under which tight control of ES cell differentiation towards the mesoendoderm lineage can be achieved.	Medical Research Council	Fellowship	316485.0	GBP
46	Dr Giacomo CAVALLI	Centre National De La Recherche Scientifique (CNRS)	None	2009-09-01	2014-09-01	Polycomb in development, genome regulation and cancer	Polycomb group (PcG) and trithorax group (trxG) genes were discovered in Drosophila melanogaster as repressors and activators of Hox genes, a set of transcription factors that specify the antero-posterior axis of the body plan. PcG and trxG proteins form multimeric complexes that are required to maintain their expression state after the initial transcriptional regulators disappear from the embryo. Subsequent work led to a better understanding of their mechanisms of action. Moreover, PcG and trxG genes have also been identified in vertebrates, where they regulate Hox genes, they are involved in cell proliferation, stem cell identity and cancer, genomic imprinting in plants and mammals and X inactivation.PcG and trxG components form multimeric complexes. Some trxG and PcG components possess methyltransferase activities directed toward specific lysines of histone H3, whereas other trxG and PcG proteins interpret these histone marks. Recent studies have described the genomewide distribution of PcG proteins and of their related histone modification in Drosophila and other species. However, the ?PcG recruitment code? to their target chromatin is still not understood, and the mechanism of PcG-mediated gene silencing is unclear. The formation of subnuclear silencing compartments might contribute to the stable repression of transcription. Drosophila PcG proteins have a speckled nuclear distribution and the number of these so-called ?PcG bodies? is progressively reduced during development. We showed that multiple PREs can associate in the nucleus to enhance the strength of PcG-mediated silencing. However, we do not know how frequent is this clustering process and how important it is functionally at a genomewide level. Our project will tackle these questions by using a combination of genetics, developmental biology, cell biology, genomics and bioinformatic approaches, with the aim to gain an integrated understanding of the role of Polycomb and trithorax in biology	European Research Council	Advanced Grant	2200000.0	EUR
