47	Dr Tom Milne	University of Oxford	None	2012-04-01	2017-03-31	The Epigenetic Control of Gene Expression in Leukaemia and Haematopoiesis	The Mixed Lineage Leukaemia 1 protein (MLL1) protein is important for the epigenetic regulation of gene expression during stem and progenitor cell development but is also mutated in a subset of aggressive human leukaemias. The most common leukaemic disruptions of the MLL1 gene are chromosome translocations that fuse the N terminus of MLL1 in frame with over 40 different partner genes creating novel fusion proteins. Recent work has suggested that wild type MLL1 and MLL1 fusion proteins cooperate in leukaemogenesis by together causing aberrant epigenetic profiles at target genes in vivo. Epigenetic changes are often defined as heritable changes in gene expression or chromosome stability that don’t alter the underlying DNA sequence. We are interested in identifying the key molecular events in MLL1 mediated leukaemogenesis in order to fully understand the epigenetic basis for this disease. This major goal has been divided into three key questions: 1) What key downstream gene targets are essential for MLL1 mediated leukaemogenesis?; 2) how do MLL1 and MLL1 fusion proteins control epigenetic gene regulation on a molecular level?; and 3) how are MLL1 and MLL1 fusion proteins recruited to important gene targets in the cell? To answer these questions, we are using xenograft transplant assays to identify Leukaemic Stem Cells (LSCs) in MLL1 patient samples, ChIP-seq to identify and characterise direct gene targets in specific haematopoietic cell populations, small molecular inhibitors and siRNA combined with ChIP and ChIP-seq to determine how MLL1 fusion proteins regulate gene targets in the cell and MLL1 domain analysis coupled with genome wide techniques to determine how MLL1 is recruited to gene targets in the cell. Answering these questions may not only be useful for future therapeutic strategies, but will also inform our basic understanding of epigenetic gene regulation during normal stem and progenitor cell development.	Medical Research Council	Unit	None	None
48	Professor Alan Knox	University Of Nottingham	Division Of Respiratory Medicine	2010-01-01	2012-08-31	Peroxisome Proliferator-Activated Receptor-gamma: a novel therapeutic target for asthma?	Asthma is one of the commonest chronic diseases to affect people in more developed countries. It is an important cause of illness in children as well as adults and can lead to absence from school and work, frequent hospital visits and continues to cause a significant number of deaths. The annual cost to the NHS of providing care for people with asthma has been estimated to be around £1 billion. Although many people with asthma are treated effectively, a sizeable proportion of people struggle with poorly controlled asthma, which greatly affects their quality of life and leads to substantial use of NHS resources. New effective ways of treating asthma are needed. Studies in the laboratory that we and others have carried out using cells grown from the airways of people with asthma have shown that drugs that stimulate a certain receptor (called peroxisome proliferator-activated receptor-gamma or PPAR-gamma) have anti-inflammatory effects and could, therefore, be useful in the treatment of asthma. The proposed project will determine whether the effects seen in the laboratory can also be seen in people with asthma. This will involve us carrying out a small clinical trial in which 100 people with asthma are given either pioglitazone (a drug that stimulates the PPAR-gamma receptor) or a placebo (dummy treatment that looks like the pioglitazone treatment but doesn't contain active drug) for 12 weeks. We will then measure markers of asthma control (for example lung function) and effects on markers of inflammation in sputum samples in the group of patients who were given pioglitazone and the group who were given the dummy treatment and compare these measures between the groups using statistical tests. This will help us to determine whether drugs that stimulate these receptors could become a completely new approach for the treatment of asthma. The project will be carried out by a team of researchers with a strong track record of successfully designing and completing clinical studies in patients with asthma and other respiratory diseases. It will be conducted in state of the art research facilities at the University of Nottingham and will benefit from the recent award of a Biomedical Research Unit in Respiratory diseases, a £6.1 million investment by the National Institute for Health Research. Specifically, the project willl be supported by a dedicated research nurse and doctor, other members of the clinical trials research team and will also benefit from established clinical trials resources and state of the art research facilities. The availability of these resources has helped us to keep the cost of the proposed project below £100,000.	National Institute for Health Research (Department of Health)	Full Grant	123998.0	GBP
49	Prof Eric Miska	University of Cambridge	None	2000-08-01	2002-08-31	Analysis of the pathways antagonising RAS signalling in C. elegans with a focus on histone modification and chromosome remodelling.	None	Wellcome Trust	Intermediate Fellowship	60093.0	GBP
50	Dr Grant Stewart	University of Birmingham	Cancer Sciences	2015-01-01	2017-12-31	Defining a fundamental role for histone methylation in preventing DNA damage-induced replication catastrophe	'Replication stress' is a term that encompasses any type of abnormality that obstructs replication, the common result of which is increased genome instability. In addition to the well-established link between genomic instability and tumour development, it is becoming increasingly evident that replication stress is also an important pathological process underlying the development of human disease. It is thought that failed replication caused by unrepaired DNA damage leads to increased cell death, particularly in highly proliferative tissues. This is exemplified by the human syndrome Fanconi Anaemia (FA), which is characterised by developmental defects, progressive bone marrow failure, tumour predisposition and a hypersensitivity to agents that induce replication stress e.g. Mitomycin C (MMC). The study of human disorders such as FA and the cellular pathways affected in these patients has significantly furthered our understanding of the molecular mechanisms that have evolved to protect against the deleterious effects of replication stress. Here we have identified PFAP (Putative Fanconi Anaemia Protein), a member of a histone methyltransferase complex, as a novel suppressor of replication stress. Cells lacking PFAP exhibit a strikingly similar phenotype to that associated with defects in the FA DNA repair pathway, such as a hypersensitivity to MMC, damage-induced replication abnormalities and chromosomal breakage following exposure to MMC. Taken together, these data suggest that PFAP functions to coordinate the repair of replication-associated DNA damage in conjunction with the FA pathway. Our finding that PFAP depleted cells also have reduced levels of histone methylation provides the first evidence of a mechanistic link between epigenetic histone modification and the maintenance of genome stability. Our proposal focuses on understanding how PFAP promotes the repair of damaged replication forks and whether this is mediated through histone methylation.	Medical Research Council	Research Grant	347743.0	GBP
51	Professor Ana Pombo	Imperial College London	None	2010-03-01	2013-02-28	Mechanisms of regulation of RNA polymerase II phosphorylation in embryonic stem cell pluripotency and neuronal differentiation	The differentiation from ES to specialized cells is one of the most important fields of research in modern cell biology. To unveil the mechanisms by which programs of gene expression are established during differentiation represents a key challenge towards the development of stem cell therapies and differentiation protocols into specific cellular lineages. Recent work has shown that important cohorts of developmental regulator genes are silent in ESCs but primed for activation upon differentiation. We and others have shown that the poised state reflects an equilibrium between Polycomb silencing by histone modification and the presence of poised RNAPII complexes, which elongate through coding regions, but lack Ser2 phosphorylation which uncouples transcription from downstream RNA processing events such as RNA splicing and polyadenylation. Poised RNAPII have not yet been identified in lineage-committed cells, but are likely to occurs since Polycomb silencing is essential during development. The molecular mechanisms that regulate the poised state of RNAPII at developmental regulator genes in ESCs are still unknown. The aims of this proposal are to: 1) investigate dynamic changes in RNAPII phosphorylation during neuronal commitment of ESCs in neural stem cells and post-mitotic neurons, and 2) to address the mechanisms of RNAPII poising regulated by the modulators of RNAPII activity in ESC pluripotency, using a combination of ChIP, siRNA, and transcriptome analyses. The Systems Approach proposed to integrate epigenetic and expression data obtained here during neuronal commitment and upon interference with the regulatory networks that control RNAPII activity in ESCs will provide important insights about the chromatin priming mechanisms that are active in ESCs. The accomplishment of these objectives will clarify important transcriptional mechanisms of outstanding interest in the biology of pluripotent cells and in the basic mechanisms of gene regulation.	Biotechnology and Biological Sciences Research Council	Standard grant	334903.0	GBP
52	Dr Patrick Varga-Weisz	Babraham Institute	Nuclear Dynamics	2016-03-01	2019-05-19	Role of chromatin dynamics in regulation of intestinal innate immunity gene expression	How chromatin dynamics in the intestinal epithelium orchestrates innate immunity is an important question but little is known about it. Our hypothesis is that chromatin dynamics, especially changes of histone variant H2AZ occupancy over CpG islands, regulate innate immunity gene expression in intestinal epithelium cells. We propose that histone H2AZ occupancy relates to cellular stress and the innate immunity response, e.g., during exposure to microbes, may reflect such a stress. To test this, we will exploit a very well established colitis model in the mouse, Dextran Sodium Sulfate (DSS) mediated colitis, and focus on the role of two chromatin remodeling factors that promote (EP400) and counteract (Smarcad1) histone H2AZ occupancy. We will examine an exciting new histone modification, crotonylation, which we find is affected by chromatin remodeling and may be linked to H2AZ occupancy and possible the microbiota. We will use chromatin immunoprecipitation coupled to high-throughput sequencing (ChIPseq) approaches to map histone H2AZ, histone crotonylation and chromatin remodeling factor occupancy during normal and colitis conditions and link these occupancies to a detailed analysis of the transcriptome, including the noncoding transcriptome. We will systematically examine CpG island chromatin using mass spectrometry approaches under all these conditions. Our work will test if chromatin remodeling factors are involved in coordinating an innate immunity response. Together, data generated in this proposal will paint a detailed picture how the transcriptome in colon epithelial cells is affected during colitis and how chromatin dynamics prime these cells to respond to an insult.	Medical Research Council	Research Grant	411823.0	GBP
53	Miss Elisabeth O'Flaherty	University of Edinburgh	None	2016-06-01	2016-07-31	Investigating epigenetic reprogramming in early mouse embryos using histone modification inhibitors	This project will investigate the role of histone methylation in mouse preimplantation development, in terms of its involvement in zygotic programming and the onset of gene activation in the early embryo. The project will test the hypothesis that epigenetic pronuclear patterns and parental assymmetries are actively maintained in the zygote and that a sequence of changes in histone methylation levels is required for the onset of gene activation. The experiments will employ in vitro culture of mouse zygotes to assess the effects of histone methyltransferase and demethylase inhibitors on preimplantation development, downstream epigenetic markers and early gene expression timing. The goal is to obtain more information on the mechanism through the use of small molecule inhibitors of key steps in the reprogramming process. The study aims to progress understanding of zygotic programming mechanisms that are essential for early development. The results will be relevant to human embryology and assisted reproduction, and will contribute insights applicable to somatic cell reprogramming for regenerative medicine.	Wellcome Trust	Vacation Scholarships	2000.0	GBP
54	Bart Deplancke	EPF Lausanne	Laboratoire de Génétique Comportementale EPFL - SV - BMI	2015-04-01	2018-03-31	Dissecting co-repressor-centered gene regulatory networks underlying dendritic cell immune responses controlling T helper cell differentiation	Dendritic cells (DCs) are specialized antigen-presenting cells that have the capacity to distinguish between the myriad of different pathogens by integrating both environmental and pathogen-derived signals. Their role consists in translating the pathogen-derived information to prime an appropriate T cell mediated immune response. Together with cells of the innate immune system, DCs induce the development of different types of CD4+ T helper cell subsets, including Th1, Th2, Th9, Th17 and regulatory T cells (Tregs) to clear a specific pathogen and/or avoid immunopathology. Little is known about how DCs interpret and integrate multiple pathogen signals to which they are exposed to ensure appropriate education of the responding T cells. This paucity in understanding fundamental aspects of DC biology is in part due to the unavailability of a DC line that can faithfully mimic the ex vivo DC responses. Here, we will have the advantage of using DC cell lines that have recently been established and extensively characterized by Hans Acha-Orbea’s group at the University of Lausanne, Switzerland. These cell lines share remarkable similarities with ex vivo derived DCs, in terms of cross-presentation of antigen, response to maturation stimuli, cytokine & chemokine secretion, and induction of costimulatory molecules.Differential gene expression is controlled by site-specific DNA binding transcription factors (TFs). One superfamily of TFs, the nuclear receptors (NRs) consists of ligand-dependent TFs and they control their target genes by switching from co-repressor to co-activator binding in a ligand dependent manner. Recent reports suggest that treatment of DCs with high affinity NR ligands such as rosiglitazone and vitamin-D for PPAR? and Vitamin-D receptor (VDR) respectively modulate their activation and maturation signals resulting in altered immune responses. This strongly indicates an important role of nuclear receptor co-repressors in controlling the function of DCs. The co-repressors NCoR1 and SMRT were originally identified as interaction partners of unliganded NRs but recent studies revealed that they also interact with non-NR TFs such as NFkB, RBPjk, and AP1 that also play a crucial role in controlling DC immune responses. It has been assumed that these co-repressors control gene transcription by recruiting histone deacetylases (HDACs). Contrary to this, we found in pre-adipocytes that co-repressors bind predominantly at open chromatin/enhancers marked by H3K27ac/H3K4me1 suggestive that they in fact co-localize with co-activators (p300). Recent studies reporting NCoR1 and SMRT DNA binding profiling in macrophages revealed that they directly regulate genes, accountable for antigen recognition, costimulation and T cell speciation in DCs. However, until now there has been no systematic study elucidating the role of these co-repressors on DC activation, maturation, and its impact on T cell priming. The overarching aim of this study therefore is to characterize the involvement of these co-repressors in enabling DCs to modulate the repertoire of T cell differentiation in vitro and in vivo in response to different antigenic stimuli. Specifically, we propose to determine the genome-wide DNA targets of these co-repressors, their protein interaction partners, and how and to which extent they influence gene expression or repression, collectively aiming to acquire a comprehensive picture of the co-repressor-controlled regulatory networks mediating DC immune responses.This immuno-genomics approach will help us to better understand how antigen signals are integrated in DCs, which in turn may be of great value to generate approaches aimed at manipulating the immunogenic and tolerogenic properties of DCs to stimulate or attenuate T cell specific immune responses. The potential findings of this research project have important implications in vaccinology, autoimmunity, cancer, and treatment of chronic infections.The following objectives are proposed:(i)Characterize the role of the co-repressors NCoR1 and SMRT in DC immune response generation under different antigen stimulation conditions (microbial CpG, viral Poly-IC, host derived factor IFN? and combined stimulation with all three antigens) using stable NCoR1/SMRT gene knockdown (KD) CD8a+ DCs. An integrative immuno-genomics approach will be used for this purpose. Thereafter, we plan to evaluate the impact of these altered responses on T helper cell differentiation into various subtypes. (ii)Validate the effect of these co-repressors in vivo on DC function and on skewing of the effecter T helper cell lineage using DC-specific conditional knockout mice for NCoR1 and SMRT. (iii)Perform population and single cell transcriptomics of in situ isolated CD8a+ DCs and CD69+ activated T helper cells isolated from the spleen of co-repressor KO and wild type animals immunized with antigens. (iv)Determine the genome-wide DNA-binding profiles of NCoR1, SMRT as well as H3K27ac histone modification enrichment in DCs stimulated with CpG, polyIC, IFN? and combined stimulation with all three antigens to identify the genome-wide targets of these co-repressors and binding dynamics. (v)Integrate computationally, the ChIP-seq and RNA-seq datasets to identify the direct/indirect target genes controlled by these co-repressors. De novo motif search within co-repressor bound DNA regions may thereby reveal the identity of TFs that mediate DNA recruitment of the co-repressors to DNA. We will further classify the direct target genes of these co-repressors into different functional groups (Cistrome) according to different TF-corepressor interactions and annotate the functional relevance of these cistromes.(vi)Construct co-repressor-mediated gene regulatory networks controlling DC activation and maturation and thereby T helper cell speciation, aiming to elucidate the gene regulatory mechanisms underlying DC immune responses when exposed to specific antigens and to develop novel strategies to modulate DC function and thereby T cell differentiation.(vii)Experimental validation of computationally predicted TF-corepressor interactions by perturbing selected TFs or TF-corepressor interactions to characterize their impact on DC functions.	Swiss National Science Foundation	India	249983.0	CHF
55	Dr. Sophie POLO	CENTRE NATIONAL DE LA RECHERCHE SCIENTIFIQUE CNRS	None	2019-03-01	2024-02-29	Epigenome maintenance in response to DNA damage	Cell viability and homeostasis rely on the stable maintenance of the epigenetic information conveyed by chromatin, which associates DNA and histone proteins in the cell nucleus and governs gene expression programs. Yet, epigenome integrity is challenged during all DNA transactions, including DNA damage repair. While much effort has been devoted to characterizing chromatin alterations in response to DNA damage and how they contribute to the repair response, our knowledge of this fundamental process is largely incomplete, and whether and how epigenetic features are re-established following a genotoxic stress challenge is still unexplored. Thus, a comprehensive framework of the mechanisms underlying the maintenance of epigenome integrity in response to DNA damage is lacking. The present project aims to fill this important gap by profiling the epigenome of repair patches following UVC damage in human cells and by characterizing the molecular players contributing to chromatin restoration/plasticity. I propose an integrated approach that tackles this question at different levels of chromatin organization, from histone and DNA modifications up to higher-order chromatin folding. Building on our unique expertise and through the development of powerful novel methodologies, combining cutting-edge imaging, proteomics and epigenomic technologies, we will elucidate mechanisms for (1) histone modification re-establishment and maintenance and (2) DNA methylation inheritance at repair sites. We will also investigate how repair-associated changes in DNA and histone modifications reflect at the level of (3) higher-order chromatin organization in the tridimensional nuclear space, and dissect (4) functional crosstalks between the epigenetic changes that arise in damaged chromatin. This ambitious research project represents an unprecedented effort towards a comprehensive and integrated understanding of epigenome maintenance mechanisms in response to genotoxic stress.	European Research Council	Consolidator Grant	1738750.0	EUR
56	Dr Shantanu Chowdhury	CSIR-Institute of Genomics and Integrative Biology	Functional Genomics	2019-10-01	2024-09-30	Molecular Mechanisms of how Telomeres impact global gene expression: Potential Role of TRF2 in telomere-chromatin interactions	Our chromosome ends called telomeres impact ageing and cancer. Although this is common knowledge, underlying molecular processes remain unclear. Recent findings suggest telomere-associated proteins bind DNA outside telomeres genome-wide. Therefore, whether and how telomeres might influence extra-telomeric binding and function of such proteins is interesting. Our new data show that a telomeric protein regulates distantly located genes in a telomere-sensitive fashion. With this and other supporting evidence, here we investigate telomere-dependent global gene control in ways not explored before. Findings are likely to reveal molecular mechanisms linking telomeres functionally to the extra-telomeric genome.	DBT/Wellcome Trust India Alliance	Senior Fellowship Renewal	4.0346E+7	INR
57	Dr. Michael BORG	GMI - Gregor Mendel Institute of Molecular Plant Biology	None	2015-01-19	2017-01-18	Epigenetic Reprogramming of the Plant Paternal Genome	Histone proteins are a core component of chromatin that complex with DNA to facilitate nuclear packaging and gene regulation. Histone sequence variants are common in eukaryotic lineages and they generate diversity in chromatin structure to influence cellular specification and epigenetic inheritance. During spermatogenesis, animals and plants undergo a dramatic structural organization of the genome that serves to tightly package and protect paternal chromatin in preparation for its delivery to the female gametes. Studies in mice have shown that testis-specific histone variants mark specific loci to facilitate genome reorganization and poise genes for expression during embryogenesis. In plants, we have known of sperm specific-histone variants for nearly 20 years yet we still know little about their role in reprogramming the paternal genome. Arabidopsis sperm cells are characterized by the expression of two specific histone variants, HTB8 and HTR10, which encode histones H2B.8 and H3.10, respectively. Recent detailed marker analysis has shown that H2B.8 and H3.10 also accumulate in condensed chromatin of embryonic nuclei during late embryogenesis, suggesting a potential role in chromatin compaction. As such H2B.8 and H3.10 represent a fitting case study to explore the epigenetic role of histone variants in plant gametogenesis and late embryogenesis, providing insight into how chromatin architecture relates to differentiation. This proposal describes a 24-month project designed to characterize H2B.8 and H3.10 function by comparing both pollen and seed chromatin in Arabidopsis thaliana. In addition, pollen ontology will be used as a cellular system to profile spatial and temporal changes in chromatin organisation during development. To achieve the objectives of this proposal, the research methodology is designed to carry out five main objectives (1) to generate genome-wide maps of H2B.8 and H3.10 deposition by ChIP-seq analysis using both native and GFP antibodies (2) to use advance microscopy and profile gene expression in knockout mutants to determine the impact of H2B.8 and H3.10 on gene expression and chromatin condensation (3) to map the post-translational modifications H2B.8 and H3.10 accumulate in planta using mass-spectrometry (4) to compare the histone complement and global modification state of progenitor germ cell, sperm cell and vegetative cell chromatin using quantitative mass spectrometry (5) to identify H2B.8 and H3.10 orthologues in different angiosperm families and to demonstrate conserved male gamete-specificity using in situ hybridisation. The project is proposed to take place in Dr Frederic Berger’s lab at the Gregor Mendel Institute in Vienna.	Austrian Science Fund FWF	Lise Meitner Programme	157380.0	EUR
